entity_id,entity_type,name,description,temperature_max,strength,conductivity,ph,salinity,source
uniprot-A0A0C5B5G6,protein,Mitochondrial-derived peptide MOTS-c (Mitochondrial open reading frame of the 12S rRNA-c),"Gene: MT-RNR1. Organism: Homo sapiens (Human). Function: FUNCTION: Regulates insulin sensitivity and metabolic homeostasis (PubMed:25738459, PubMed:33468709). Inhibits the folate cycle, thereby reducing de novo purine biosynthesis which leads to the accumulation of the de novo purine synthesis intermediate 5-aminoimidazole-4-carboxamide (AICAR) and the activation of the metabolic regulator 5'-AMP-activated protein kinase (AMPK) (PubMed:25738459). Protects against age-dependent and diet-induced insulin resistance as well as diet-induced obesity (PubMed:25738459). In response to metabolic stress, translocates to the nucleus where it binds to antioxidant response elements (ARE) present in the promoter regions of a number of genes and plays a role in regulating nuclear gene expression in an NFE2L2-dependent manner and increasing cellular resistance to metabolic stress (PubMed:29983246). Increases mitochondrial respiration and levels of CPT1A and cytokines IL1B, IL6, IL8, IL10 and TNF in senescent cells (PubMed:29886458). Increases activity of the serine/threonine protein kinase complex mTORC2 and reduces activity of the PTEN phosphatase, thus promoting phosphorylation of AKT (PubMed:33554779). This promotes AKT-mediated phosphorylation of transcription factor FOXO1 which reduces FOXO1 activity, leading to reduced levels of MSTN and promotion of skeletal muscle growth (PubMed:33554779). Promotes osteogenic differentiation of bone marrow mesenchymal stem cells via the TGFB/SMAD pathway (PubMed:30468456). Promotes osteoblast proliferation and osteoblast synthesis of type I collagens COL1A1 and COL1A2 via the TGFB/SMAD pathway (PubMed:31081069). {ECO:0000269|PubMed:25738459, ECO:0000269|PubMed:29886458, ECO:0000269|PubMed:29983246, ECO:0000269|PubMed:30468456, ECO:0000269|PubMed:31081069, ECO:0000269|PubMed:33468709, ECO:0000269|PubMed:33554779}..",,,,,,UniProt
uniprot-A0A1B0GTW7,protein,Ciliated left-right organizer metallopeptidase (EC 3.4.24.-) (Leishmanolysin-like peptidase 2),Gene: CIROP. Organism: Homo sapiens (Human). Function: FUNCTION: Putative metalloproteinase that plays a role in left-right patterning process. {ECO:0000250|UniProtKB:A0A1D5NSK0}..,,,,,,UniProt
uniprot-A0JNW5,protein,Bridge-like lipid transfer protein family member 3B (Syntaxin-6 Habc-interacting protein of 164 kDa) (UHRF1-binding protein 1-like),"Gene: BLTP3B. Organism: Homo sapiens (Human). Function: FUNCTION: Tube-forming lipid transport protein which mediates the transfer of lipids between membranes at organelle contact sites (PubMed:35499567). Required for retrograde traffic of vesicle clusters in the early endocytic pathway to the Golgi complex (PubMed:20163565, PubMed:35499567). {ECO:0000269|PubMed:20163565, ECO:0000269|PubMed:35499567}..",,,,,,UniProt
uniprot-A0JP26,protein,POTE ankyrin domain family member B3,Gene: POTEB3. Organism: Homo sapiens (Human). Function: nan.,,,,,,UniProt
uniprot-A0PK11,protein,Clarin-2,Gene: CLRN2. Organism: Homo sapiens (Human). Function: FUNCTION: Plays a key role to hearing function. Required for normal organization and maintenance of the stereocilia bundle and for mechano-electrical transduction. {ECO:0000250|UniProtKB:B2RVW2}..,,,,,,UniProt
uniprot-A1A4S6,protein,Rho GTPase-activating protein 10 (GTPase regulator associated with focal adhesion kinase 2) (GRAF2) (Graf-related protein 2) (Rho-type GTPase-activating protein 10),"Gene: ARHGAP10. Organism: Homo sapiens (Human). Function: FUNCTION: GTPase-activating protein that catalyzes the conversion of active GTP-bound Rho GTPases to their inactive GDP-bound form, thus suppressing various Rho GTPase-mediated cellular processes (PubMed:11432776). Also converts Cdc42 to an inactive GDP-bound state (PubMed:11432776). Essential for PTKB2 regulation of cytoskeletal organization via Rho family GTPases. Inhibits PAK2 proteolytic fragment PAK-2p34 kinase activity and changes its localization from the nucleus to the perinuclear region. Stabilizes PAK-2p34 thereby increasing stimulation of cell death (By similarity). Associates with MICAL1 on the endosomal membrane to promote Rab8-Rab10-dependent tubule extension. After dissociation with MICAL1, recruits WDR44 which connects the endoplasmic reticulum (ER) with the endosomal tubule, thereby participating in the export of a subset of neosynthesized proteins (PubMed:32344433). {ECO:0000250|UniProtKB:Q6Y5D8, ECO:0000269|PubMed:11432776, ECO:0000269|PubMed:32344433}..",,,,,,UniProt
uniprot-A1A519,protein,Protein FAM170A (Zinc finger domain-containing protein) (Zinc finger protein ZNFD),Gene: FAM170A. Organism: Homo sapiens (Human). Function: FUNCTION: Acts as a nuclear transcription factor that positively regulates the expression of heat shock genes. Binds to heat shock promoter elements (HSE). {ECO:0000269|PubMed:20162441}..,,,,,,UniProt
uniprot-A1L190,protein,Synaptonemal complex central element protein 3 (Testis highly expressed gene 2 protein) (THEG-2),"Gene: SYCE3. Organism: Homo sapiens (Human). Function: FUNCTION: Major component of the transverse central element of synaptonemal complexes (SCS), formed between homologous chromosomes during meiotic prophase (PubMed:36635604). Required for the assembly of the central element of the synaptonemal complex during meiosis, via remodeling of SYCP1 lattice structures and promoting recruitment of SYCE2-TEX12 and SYCE1-SIX60S1 complexes (PubMed:36635604). Required for chromosome loading of the central element-specific SCS proteins, and for initiating synapsis between homologous chromosomes (By similarity). Chromosome loading appears to require SYCP1 (By similarity). Required for fertility and normal testis development (By similarity). {ECO:0000250|UniProtKB:B5KM66, ECO:0000269|PubMed:36635604}..",,,,,,UniProt
uniprot-A1L3X0,protein,Very long chain fatty acid elongase 7 (EC 2.3.1.199) (3-keto acyl-CoA synthase ELOVL7) (ELOVL fatty acid elongase 7) (ELOVL FA elongase 7) (Elongation of very long chain fatty acids protein 7) (Very long chain 3-ketoacyl-CoA synthase 7) (Very long chain 3-oxoacyl-CoA synthase 7),"Gene: ELOVL7. Organism: Homo sapiens (Human). Function: FUNCTION: Catalyzes the first and rate-limiting reaction of the four reactions that constitute the long-chain fatty acids elongation cycle. This endoplasmic reticulum-bound enzymatic process allows the addition of 2 carbons to the chain of long- and very long-chain fatty acids (VLCFAs) per cycle. Condensing enzyme with higher activity toward C18 acyl-CoAs, especially C18:3(n-3) acyl-CoAs and C18:3(n-6)-CoAs. Also active toward C20:4-, C18:0-, C18:1-, C18:2- and C16:0-CoAs, and weakly toward C20:0-CoA. Little or no activity toward C22:0-, C24:0-, or C26:0-CoAs. May participate in the production of saturated and polyunsaturated VLCFAs of different chain lengths that are involved in multiple biological processes as precursors of membrane lipids and lipid mediators. {ECO:0000255|HAMAP-Rule:MF_03207, ECO:0000269|PubMed:19826053, ECO:0000269|PubMed:20937905, ECO:0000269|PubMed:21959040, ECO:0000269|PubMed:34117479}..",,,,,,UniProt
uniprot-A1X283,protein,SH3 and PX domain-containing protein 2B (Adapter protein HOFI) (Factor for adipocyte differentiation 49) (Tyrosine kinase substrate with four SH3 domains),"Gene: SH3PXD2B. Organism: Homo sapiens (Human). Function: FUNCTION: Adapter protein involved in invadopodia and podosome formation and extracellular matrix degradation. Binds matrix metalloproteinases (ADAMs), NADPH oxidases (NOXs) and phosphoinositides. Acts as an organizer protein that allows NOX1- or NOX3-dependent reactive oxygen species (ROS) generation and ROS localization. Plays a role in mitotic clonal expansion during the immediate early stage of adipocyte differentiation (By similarity). {ECO:0000250, ECO:0000269|PubMed:12615925, ECO:0000269|PubMed:19755710, ECO:0000269|PubMed:20609497}..",,,,,,UniProt
uniprot-A2A2Y4,protein,FERM domain-containing protein 3 (Band 4.1-like protein 4O) (Ovary type protein 4.1) (4.1O),Gene: FRMD3. Organism: Homo sapiens (Human). Function: FUNCTION: Putative tumor suppressor gene that may be implicated in the origin and progression of lung cancer. {ECO:0000269|PubMed:17260017}..,,,,,,UniProt
uniprot-A2RU14,protein,Transmembrane protein 218,Gene: TMEM218. Organism: Homo sapiens (Human). Function: FUNCTION: May be involved in ciliary biogenesis or function. {ECO:0000250|UniProtKB:Q9CQ44}..,,,,,,UniProt
uniprot-A2RUB6,protein,Coiled-coil domain-containing protein 66,"Gene: CCDC66. Organism: Homo sapiens (Human). Function: FUNCTION: Microtubule-binding protein required for ciliogenesis (PubMed:28235840). May function in ciliogenesis by mediating the transport of proteins like BBS4 to the cilium, but also through the organization of the centriolar satellites (PubMed:28235840). Required for the assembly of signaling-competent cilia with proper structure and length (PubMed:36606424). Mediates this function in part by regulating transition zone assembly and basal body recruitment of the IFT-B complex (PubMed:36606424). Cooperates with the ciliopathy proteins CSPP1 and CEP104 during cilium length regulation (PubMed:36606424). Plays two important roles during cell division (PubMed:35849559). First, is required for mitotic progression via regulation of spindle assembly, organization and orientation, levels of spindle microtubules (MTs), kinetochore-fiber integrity, and chromosome alignment (PubMed:35849559). Second, functions during cytokinesis in part by regulating assembly and organization of central spindle and midbody MTs (PubMed:35849559). Plays a role in retina morphogenesis and/or homeostasis (By similarity). {ECO:0000250|UniProtKB:Q6NS45, ECO:0000269|PubMed:28235840, ECO:0000269|PubMed:35849559}..",,,,,,UniProt
uniprot-A2RUC4,protein,tRNA wybutosine-synthesizing protein 5 (hTYW5) (tRNA yW-synthesizing protein 5) (EC 1.14.11.42) (tRNA(Phe) (7-(3-amino-3-carboxypropyl)wyosine(37)-C(2))-hydroxylase),"Gene: TYW5. Organism: Homo sapiens (Human). Function: FUNCTION: tRNA hydroxylase that acts as a component of the wybutosine biosynthesis pathway. Wybutosine is a hyper modified guanosine with a tricyclic base found at the 3'-position adjacent to the anticodon of eukaryotic phenylalanine tRNA. Catalyzes the hydroxylation of 7-(a-amino-a-carboxypropyl)wyosine (yW-72) into undermodified hydroxywybutosine (OHyW*). OHyW* being further transformed into hydroxywybutosine (OHyW) by LCMT2/TYW4. OHyW is a derivative of wybutosine found in higher eukaryotes. {ECO:0000269|PubMed:20739293, ECO:0000269|PubMed:20972222}..",,,,,,UniProt
uniprot-A3KN83,protein,Protein strawberry notch homolog 1 (Monocyte protein 3) (MOP-3),"Gene: SBNO1. Organism: Homo sapiens (Human). Function: FUNCTION: Plays a crucial role in the regulation of neural stem cells (NSCs) proliferation. Enhances the phosphorylation of GSK3B through the PI3K-Akt signaling pathway, thereby upregulating the Wnt/beta-catenin signaling pathway and promoting the proliferation of NSCs. Improves ischemic stroke recovery while inhibiting neuroinflammation through small extracellular vesicles (sEVs)-mediated mechanism. Enhances the secretion of sEVs from NSCs, which in turn inhibit both the MAPK and NF-kappaB pathways in microglia. This inhibition suppresses the pro-inflammatory M1 polarization of microglia, promoting a shift towards the M2 anti-inflammatory phenotype, which is beneficial for reducing neuroinflammation. {ECO:0000250|UniProtKB:Q689Z5}..",,,,,,UniProt
uniprot-A4D1B5,protein,Gamma-secretase-activating protein (GSAP) (Protein pigeon homolog) [Cleaved into: Gamma-secretase-activating protein 16 kDa C-terminal form (GSAP-16K)],"Gene: GSAP. Organism: Homo sapiens (Human). Function: FUNCTION: Regulator of gamma-secretase activity, which specifically activates the production of amyloid-beta protein (amyloid-beta protein 40 and amyloid-beta protein 42), without affecting the cleavage of other gamma-secretase targets such has Notch. The gamma-secretase complex is an endoprotease complex that catalyzes the intramembrane cleavage of integral membrane proteins such as Notch receptors and APP (amyloid-beta precursor protein). Specifically promotes the gamma-cleavage of APP CTF-alpha (also named APP-CTF) by the gamma-secretase complex to generate amyloid-beta, while it reduces the epsilon-cleavage of APP CTF-alpha, leading to a low production of AICD. {ECO:0000269|PubMed:20811458}..",,,,,,UniProt
uniprot-A4GXA9,protein,Structure-specific endonuclease subunit EME2 (Essential meiotic structure-specific endonuclease subunit 2),"Gene: EME2. Organism: Homo sapiens (Human). Function: FUNCTION: Non-catalytic subunit of the structure-specific, heterodimeric DNA endonuclease MUS81-EME2 which is involved in the maintenance of genome stability. In the complex, EME2 is required for DNA cleavage, participating in DNA recognition and bending (PubMed:17289582, PubMed:24371268, PubMed:24813886, PubMed:35290797). MUS81-EME2 cleaves 3'-flaps and nicked Holliday junctions, and exhibit limited endonuclease activity with 5' flaps and nicked double-stranded DNAs (PubMed:24371268). MUS81-EME2 which is active during the replication of DNA is more specifically involved in replication fork processing (PubMed:17289582, PubMed:24813886). Replication forks frequently encounter obstacles to their passage, including DNA base lesions, DNA interstrand cross-links, difficult-to-replicate sequences, transcription bubbles, or tightly bound proteins. One mechanism for the restart of a stalled replication fork involves nucleolytic cleavage mediated by the MUS81-EME2 endonuclease. By acting upon the stalled fork, MUS81-EME2 generates a DNA double-strand break (DSB) that can be repaired by homologous recombination, leading to the restoration of an active fork (PubMed:24813886). MUS81-EME2 could also function in telomere maintenance (PubMed:24813886). {ECO:0000269|PubMed:17289582, ECO:0000269|PubMed:24371268, ECO:0000269|PubMed:24813886, ECO:0000269|PubMed:35290797}..",,,,,,UniProt
uniprot-A5D8V7,protein,Outer dynein arm-docking complex subunit 3 (Coiled-coil domain-containing protein 151),Gene: ODAD3. Organism: Homo sapiens (Human). Function: FUNCTION: Component of the outer dynein arm-docking complex (ODA-DC) that mediates outer dynein arms (ODA) binding onto the doublet microtubule (PubMed:25192045). Involved in mediating assembly of both ODAs and their axonemal docking complex onto ciliary microtubules (PubMed:25192045). {ECO:0000269|PubMed:25192045}..,,,,,,UniProt
uniprot-A5PLL7,protein,Plasmanylethanolamine desaturase 1 (EC 1.14.19.77) (Transmembrane protein 189),"Gene: PEDS1. Organism: Homo sapiens (Human). Function: FUNCTION: Plasmanylethanolamine desaturase involved in plasmalogen biogenesis in the endoplasmic reticulum membrane (PubMed:31604315, PubMed:32209662, PubMed:33859415). Plasmalogens are glycerophospholipids with a hydrocarbon chain linked by a vinyl ether bond at the glycerol sn-1 position, and are involved in antioxidative and signaling mechanisms (PubMed:31604315). {ECO:0000269|PubMed:31604315, ECO:0000269|PubMed:32209662, ECO:0000269|PubMed:33859415, ECO:0000303|PubMed:31604315}..",,,,,,UniProt
uniprot-A6BM72,protein,Multiple epidermal growth factor-like domains protein 11 (Multiple EGF-like domains protein 11),"Gene: MEGF11. Organism: Homo sapiens (Human). Function: FUNCTION: May regulate the mosaic spacing of specific neuron subtypes in the retina through homotypic retinal neuron repulsion. Mosaics provide a mechanism to distribute each cell type evenly across the retina, ensuring that all parts of the visual field have access to a full set of processing elements (By similarity). {ECO:0000250}..",,,,,,UniProt
uniprot-A6H8Y1,protein,Transcription factor TFIIIB component B'' homolog (Transcription factor IIIB 150) (TFIIIB150) (Transcription factor-like nuclear regulator),Gene: BDP1. Organism: Homo sapiens (Human). Function: FUNCTION: General activator of RNA polymerase III transcription. Requires for transcription from all three types of polymerase III promoters. Requires for transcription of genes with internal promoter elements and with promoter elements upstream of the initiation site. {ECO:0000269|PubMed:11040218}..,,,,,,UniProt
uniprot-A6NCS4,protein,Homeobox protein Nkx-2.6 (Homeobox protein NK-2 homolog F),"Gene: NKX2-6. Organism: Homo sapiens (Human). Function: FUNCTION: Acts as a transcriptional activator (PubMed:15649947). In conjunction with NKX2-5, may play a role in both pharyngeal and cardiac embryonic development. {ECO:0000250|UniProtKB:P43688, ECO:0000269|PubMed:15649947}..",,,,,,UniProt
uniprot-A6NFY7,protein,"Succinate dehydrogenase assembly factor 1, mitochondrial (SDH assembly factor 1) (SDHAF1) (LYR motif-containing protein 8)","Gene: SDHAF1. Organism: Homo sapiens (Human). Function: FUNCTION: Plays an essential role in the assembly of succinate dehydrogenase (SDH), an enzyme complex (also referred to as respiratory complex II) that is a component of both the tricarboxylic acid (TCA) cycle and the mitochondrial electron transport chain, and which couples the oxidation of succinate to fumarate with the reduction of ubiquinone (coenzyme Q) to ubiquinol (PubMed:19465911, PubMed:24954417). Promotes maturation of the iron-sulfur protein subunit SDHB of the SDH catalytic dimer, protecting it from the deleterious effects of oxidants (PubMed:24954417). May act together with SDHAF3 (PubMed:24954417). Contributes to iron-sulfur cluster incorporation into SDHB by binding to SDHB and recruiting the iron-sulfur transfer complex formed by HSC20, HSPA9 and ISCU through direct binding to HSC20 (PubMed:26749241). {ECO:0000269|PubMed:19465911, ECO:0000269|PubMed:24954417, ECO:0000269|PubMed:26749241}..",,,,,,UniProt
uniprot-A6NGG8,protein,Photoreceptor cilium actin regulator,Gene: PCARE. Organism: Homo sapiens (Human). Function: FUNCTION: Plays an essential role for normal photoreceptor cell maintenance and vision. {ECO:0000269|PubMed:20398886}..,,,,,,UniProt
uniprot-A6NI61,protein,Protein myomaker (Myoblast fusion maker) (Transmembrane protein 226) (Transmembrane protein 8C),"Gene: MYMK. Organism: Homo sapiens (Human). Function: FUNCTION: Myoblast-specific protein that mediates myoblast fusion, an essential step for the formation of multi-nucleated muscle fibers (PubMed:28681861). Actively participates in the membrane fusion reaction by mediating the mixing of cell membrane lipids (hemifusion) upstream of MYMX. Acts independently of MYMX (By similarity). Involved in skeletal muscle regeneration in response to injury by mediating the fusion of satellite cells, a population of muscle stem cells, with injured myofibers (By similarity). Also involved in skeletal muscle hypertrophy, probably by mediating the fusion of satellite cells with myofibers (By similarity). {ECO:0000250|UniProtKB:Q9D1N4, ECO:0000269|PubMed:28681861}..",,,,,,UniProt
uniprot-A6NKB5,protein,Pecanex-like protein 2 (Pecanex homolog protein 2),"Gene: PCNX2. Organism: Homo sapiens (Human). Function: FUNCTION: May play a role in tumorigenesis of colorectal carcinomas with high microsatellite instability (MSI-H). {ECO:0000269|PubMed:12140758, ECO:0000269|PubMed:14507650}..",,,,,,UniProt
uniprot-A6NNB3,protein,Interferon-induced transmembrane protein 5 (Bone-restricted interferon-induced transmembrane protein-like protein) (BRIL) (Dispanin subfamily A member 1) (DSPA1),Gene: IFITM5. Organism: Homo sapiens (Human). Function: FUNCTION: Required for normal bone mineralization. {ECO:0000269|PubMed:24519609}..,,,,,,UniProt
uniprot-A6QL63,protein,Ankyrin repeat- and BTB/POZ domain-containing protein 3 (BTB/POZ domain-containing protein 11),"Gene: ABTB3. Organism: Homo sapiens (Human). Function: FUNCTION: Cortical and hippocampal inhibitory interneuron-specific protein localized at glutamatergic (excitatory) synapses, where it supports cell type-specific synaptic function. {ECO:0000250|UniProtKB:Q6GQW0}..",,,,,,UniProt
uniprot-A7E2V4,protein,Zinc finger SWIM domain-containing protein 8,"Gene: ZSWIM8. Organism: Homo sapiens (Human). Function: FUNCTION: Substrate recognition component of a SCF-like E3 ubiquitin-protein ligase complex that promotes target-directed microRNA degradation (TDMD), a process that mediates degradation of microRNAs (miRNAs) (PubMed:33184234, PubMed:33184237). The SCF-like E3 ubiquitin-protein ligase complex acts by catalyzing ubiquitination and subsequent degradation of AGO proteins (AGO1, AGO2, AGO3 and/or AGO4), thereby exposing miRNAs for degradation (PubMed:33184234, PubMed:33184237). Specifically recognizes and binds AGO proteins when they are engaged with a TDMD target (PubMed:33184234). May also act as a regulator of axon guidance: specifically recognizes misfolded ROBO3 and promotes its ubiquitination and subsequent degradation (PubMed:24012004). Plays an essential role for proper embryonic development of heart and lung (By similarity). Controls protein quality of DAB1, a key signal molecule for brain development, thus protecting its signaling strength. Mechanistically, recognizes intrinsically disordered regions of DAB1 and eliminates misfolded DAB1 that cannot be properly phosphorylated (By similarity). {ECO:0000250|UniProtKB:Q3UHH1, ECO:0000269|PubMed:24012004, ECO:0000269|PubMed:33184234, ECO:0000269|PubMed:33184237}.; FUNCTION: (Microbial infection) Participates in Zika virus inhibition of IFN signaling by acting as a scaffold protein to connect ZSWIM8/CUL3 ligase complex and STAT2, leading to STAT2 degradation. {ECO:0000269|PubMed:39145933}..",,,,,,UniProt
uniprot-A7MCY6,protein,TANK-binding kinase 1-binding protein 1 (TBK1-binding protein 1),Gene: TBKBP1. Organism: Homo sapiens (Human). Function: FUNCTION: Adapter protein which constitutively binds TBK1 and IKBKE playing a role in antiviral innate immunity. {ECO:0000269|PubMed:21931631}..,,,,,,UniProt
uniprot-A7MD48,protein,Serine/arginine repetitive matrix protein 4 (Medulloblastoma antigen MU-MB-2.76) (Neural-specific serine/arginine repetitive splicing factor of 100 kDa) (Neural-specific SR-related protein of 100 kDa) (nSR100),"Gene: SRRM4. Organism: Homo sapiens (Human). Function: FUNCTION: Splicing factor specifically required for neural cell differentiation. Acts in conjunction with nPTB/PTBP2 by binding directly to its regulated target transcripts and promotes neural-specific exon inclusion in many genes that function in neural cell differentiation. Required to promote the inclusion of neural-specific exon 10 in nPTB/PTBP2, leading to increased expression of neural-specific nPTB/PTBP2. Also promotes the inclusion of exon 16 in DAAM1 in neuron extracts (By similarity). Promotes alternative splicing of REST transcripts to produce REST isoform 3 (REST4) with greatly reduced repressive activity, thereby activating expression of REST targets in neural cells (PubMed:30684677). Plays an important role during embryonic development as well as in the proper functioning of the adult nervous system. Regulates alternative splicing events in genes with important neuronal functions (By similarity). {ECO:0000250|UniProtKB:Q8BKA3, ECO:0000269|PubMed:30684677}..",,,,,,UniProt
uniprot-A7XYQ1,protein,Sine oculis-binding protein homolog (Jackson circler protein 1),Gene: SOBP. Organism: Homo sapiens (Human). Function: FUNCTION: Implicated in development of the cochlea. {ECO:0000250|UniProtKB:Q0P5V2}..,,,,,,UniProt
uniprot-A8MQ03,protein,Cysteine-rich tail protein 1,Gene: CYSRT1. Organism: Homo sapiens (Human). Function: FUNCTION: Component of the stratum corneum that may contribute to epidermal antimicrobial host defenses. {ECO:0000269|PubMed:36804407}..,,,,,,UniProt
uniprot-A8MW99,protein,Meiosis-specific protein MEI4,"Gene: MEI4. Organism: Homo sapiens (Human). Function: FUNCTION: Required for DNA double-strand breaks (DSBs) formation in unsynapsed regions during meiotic recombination. Probably acts by forming a complex with IHO1 and REC114, which activates DSBs formation in unsynapsed regions, an essential step to ensure completion of synapsis. {ECO:0000250|UniProtKB:Q8BRM6}..",,,,,,UniProt
uniprot-A9UHW6,protein,MIF4G domain-containing protein (SLBP-interacting protein 1) (hSLIP1),Gene: MIF4GD. Organism: Homo sapiens (Human). Function: FUNCTION: Functions in replication-dependent translation of histone mRNAs which differ from other eukaryotic mRNAs in that they do not end with a poly-A tail but a stem-loop. May participate in circularizing those mRNAs specifically enhancing their translation. {ECO:0000269|PubMed:18025107}..,,,,,,UniProt
uniprot-B1AK53,protein,Espin (Autosomal recessive deafness type 36 protein) (Ectoplasmic specialization protein),"Gene: ESPN. Organism: Homo sapiens (Human). Function: FUNCTION: Multifunctional actin-bundling protein. Plays a major role in regulating the organization, dimension, dynamics and signaling capacities of the actin filament-rich microvilli in the mechanosensory and chemosensory cells (PubMed:29572253). Required for the assembly and stabilization of the stereociliary parallel actin bundles. Plays a crucial role in the formation and maintenance of inner ear hair cell stereocilia (By similarity). Involved in the elongation of actin in stereocilia (PubMed:29572253). In extrastriolar hair cells, required for targeting MYO3B to stereocilia tips, and for regulation of stereocilia diameter and staircase formation. {ECO:0000250|UniProtKB:Q9ET47, ECO:0000269|PubMed:29572253}..",,,,,,UniProt
uniprot-B2RUY7,protein,von Willebrand factor C domain-containing protein 2-like (VWC2-like protein) (Brorin-like),Gene: VWC2L. Organism: Homo sapiens (Human). Function: FUNCTION: May play a role in neurogenesis. May play a role in bone differentiation and matrix mineralization. {ECO:0000250}..,,,,,,UniProt
