entity_id,entity_type,name,description,temperature_max,strength,conductivity,ph,salinity,source
uniprot-O14949,protein,Cytochrome b-c1 complex subunit 8 (Complex III subunit 8) (Complex III subunit VIII) (Ubiquinol-cytochrome c reductase complex 9.5 kDa protein) (Ubiquinol-cytochrome c reductase complex ubiquinone-binding protein QP-C),"Gene: UQCRQ. Organism: Homo sapiens (Human). Function: FUNCTION: Component of the ubiquinol-cytochrome c oxidoreductase, a multisubunit transmembrane complex that is part of the mitochondrial electron transport chain which drives oxidative phosphorylation. The respiratory chain contains 3 multisubunit complexes succinate dehydrogenase (complex II, CII), ubiquinol-cytochrome c oxidoreductase (cytochrome b-c1 complex, complex III, CIII) and cytochrome c oxidase (complex IV, CIV), that cooperate to transfer electrons derived from NADH and succinate to molecular oxygen, creating an electrochemical gradient over the inner membrane that drives transmembrane transport and the ATP synthase. The cytochrome b-c1 complex catalyzes electron transfer from ubiquinol to cytochrome c, linking this redox reaction to translocation of protons across the mitochondrial inner membrane, with protons being carried across the membrane as hydrogens on the quinol. In the process called Q cycle, 2 protons are consumed from the matrix, 4 protons are released into the intermembrane space and 2 electrons are passed to cytochrome c. {ECO:0000250|UniProtKB:P08525}..",,,,,,UniProt
uniprot-O14957,protein,Cytochrome b-c1 complex subunit 10 (Complex III subunit 10) (Complex III subunit XI) (Ubiquinol-cytochrome c reductase complex 6.4 kDa protein),"Gene: UQCR11. Organism: Homo sapiens (Human). Function: FUNCTION: Component of the ubiquinol-cytochrome c oxidoreductase, a multisubunit transmembrane complex that is part of the mitochondrial electron transport chain which drives oxidative phosphorylation. The respiratory chain contains 3 multisubunit complexes succinate dehydrogenase (complex II, CII), ubiquinol-cytochrome c oxidoreductase (cytochrome b-c1 complex, complex III, CIII) and cytochrome c oxidase (complex IV, CIV), that cooperate to transfer electrons derived from NADH and succinate to molecular oxygen, creating an electrochemical gradient over the inner membrane that drives transmembrane transport and the ATP synthase. The cytochrome b-c1 complex catalyzes electron transfer from ubiquinol to cytochrome c, linking this redox reaction to translocation of protons across the mitochondrial inner membrane, with protons being carried across the membrane as hydrogens on the quinol. In the process called Q cycle, 2 protons are consumed from the matrix, 4 protons are released into the intermembrane space and 2 electrons are passed to cytochrome c. QCR10 has a role in CIII assembly and RIP1 stability. {ECO:0000250|UniProtKB:P37299}..",,,,,,UniProt
uniprot-O14958,protein,"Calsequestrin-2 (Calsequestrin, cardiac muscle isoform)","Gene: CASQ2. Organism: Homo sapiens (Human). Function: FUNCTION: Calsequestrin is a high-capacity, moderate affinity, calcium-binding protein and thus acts as an internal calcium store in muscle. Calcium ions are bound by clusters of acidic residues at the protein surface, especially at the interface between subunits. Can bind around 60 Ca(2+) ions. Regulates the release of lumenal Ca(2+) via the calcium release channel RYR2; this plays an important role in triggering muscle contraction. Plays a role in excitation-contraction coupling in the heart and in regulating the rate of heart beats. {ECO:0000269|PubMed:16908766, ECO:0000269|PubMed:17881003, ECO:0000269|PubMed:18399795, ECO:0000269|PubMed:21416293}..",,,,,,UniProt
uniprot-O14960,protein,Leukocyte cell-derived chemotaxin-2 (LECT-2) (hLECT2),"Gene: LECT2. Organism: Homo sapiens (Human). Function: FUNCTION: Has a neutrophil chemotactic activity. Also a positive regulator of chondrocyte proliferation (PubMed:9524238). Does not show metalloendopeptidase activity (PubMed:27334921). {ECO:0000269|PubMed:27334921, ECO:0000269|PubMed:9524238}..",,,,,,UniProt
uniprot-O14967,protein,Calmegin,Gene: CLGN. Organism: Homo sapiens (Human). Function: FUNCTION: Functions during spermatogenesis as a chaperone for a range of client proteins that are important for sperm adhesion onto the egg zona pellucida and for subsequent penetration of the zona pellucida. Required for normal sperm migration from the uterus into the oviduct. Required for normal male fertility. Binds calcium ions (By similarity). {ECO:0000250}..,,,,,,UniProt
uniprot-O14975,protein,"Long-chain fatty acid transport protein 2 (Arachidonate--CoA ligase) (EC 6.2.1.15) (Fatty acid transport protein 2) (FATP-2) (Fatty-acid-coenzyme A ligase, very long-chain 1) (Long-chain-fatty-acid--CoA ligase) (EC 6.2.1.3) (Phytanate--CoA ligase) (EC 6.2.1.24) (Solute carrier family 27 member 2) (THCA-CoA ligase) (EC 6.2.1.7) (Very long-chain acyl-CoA synthetase) (VLACS) (VLCS) (EC 6.2.1.-) (Very long-chain-fatty-acid-CoA ligase)","Gene: SLC27A2. Organism: Homo sapiens (Human). Function: FUNCTION: Mediates the import of long-chain fatty acids (LCFA) into the cell by facilitating their transport across cell membranes, playing an important role in hepatic fatty acid uptake (PubMed:10198260, PubMed:10749848, PubMed:11980911, PubMed:20530735, PubMed:22022213, PubMed:24269233). Also functions as an acyl-CoA ligase catalyzing the ATP-dependent formation of fatty acyl-CoA using LCFA and very-long-chain fatty acids (VLCFA) as substrates, which prevents fatty acid efflux from cells and might drive more fatty acid uptake (PubMed:10198260, PubMed:10749848, PubMed:11980911, PubMed:20530735, PubMed:22022213, PubMed:24269233). Plays a pivotal role in regulating available LCFA substrates from exogenous sources in tissues undergoing high levels of beta-oxidation or triglyceride synthesis (PubMed:20530735). Can also activate branched-chain fatty acids such as phytanic acid and pristanic acid (PubMed:10198260). May contribute to the synthesis of sphingosine-1-phosphate (PubMed:24269233). Does not activate C24 bile acids, cholate and chenodeoxycholate (PubMed:11980911). In vitro, activates 3-alpha,7-alpha,12-alpha-trihydroxy-5-beta-cholestanate (THCA), the C27 precursor of cholic acid deriving from the de novo synthesis from cholesterol (PubMed:11980911). However, it is not critical for THCA activation and bile synthesis in vivo (PubMed:20530735). {ECO:0000269|PubMed:10198260, ECO:0000269|PubMed:10749848, ECO:0000269|PubMed:11980911, ECO:0000269|PubMed:20530735, ECO:0000269|PubMed:22022213, ECO:0000269|PubMed:24269233}.; FUNCTION: [Isoform 1]: Exhibits both long-chain fatty acids (LCFA) transport activity and acyl CoA synthetase towards very long-chain fatty acids (PubMed:10198260, PubMed:21768100). Shows a preference for generating CoA derivatives of n-3 fatty acids, which are preferentially trafficked into phosphatidylinositol (PubMed:21768100). {ECO:0000269|PubMed:10198260, ECO:0000269|PubMed:21768100}.; FUNCTION: [Isoform 2]: Exhibits long-chain fatty acids (LCFA) transport activity but lacks acyl CoA synthetase towards very long-chain fatty acids. {ECO:0000269|PubMed:21768100}..",,,,,,UniProt
uniprot-O14979,protein,Heterogeneous nuclear ribonucleoprotein D-like (hnRNP D-like) (hnRNP DL) (AU-rich element RNA-binding factor) (JKT41-binding protein) (Protein laAUF1),"Gene: HNRNPDL. Organism: Homo sapiens (Human). Function: FUNCTION: Acts as a transcriptional regulator. Promotes transcription repression. Promotes transcription activation in differentiated myotubes (By similarity). Binds to double- and single-stranded DNA sequences. Binds to the transcription suppressor CATR sequence of the COX5B promoter (By similarity). Binds with high affinity to RNA molecules that contain AU-rich elements (AREs) found within the 3'-UTR of many proto-oncogenes and cytokine mRNAs. Binds both to nuclear and cytoplasmic poly(A) mRNAs. Binds to poly(G) and poly(A), but not to poly(U) or poly(C) RNA homopolymers. Binds to the 5'-ACUAGC-3' RNA consensus sequence. {ECO:0000250, ECO:0000269|PubMed:9538234}..",,,,,,UniProt
uniprot-O14994,protein,Synapsin-3 (Synapsin III),Gene: SYN3. Organism: Homo sapiens (Human). Function: FUNCTION: May be involved in the regulation of neurotransmitter release and synaptogenesis..,,,,,,UniProt
uniprot-O15067,protein,Phosphoribosylformylglycinamidine synthase (FGAM synthase) (FGAMS) (EC 6.3.5.3) (Formylglycinamide ribonucleotide amidotransferase) (FGAR amidotransferase) (FGAR-AT) (Formylglycinamide ribotide amidotransferase) (Phosphoribosylformylglycineamide amidotransferase),Gene: PFAS. Organism: Homo sapiens (Human). Function: FUNCTION: Phosphoribosylformylglycinamidine synthase involved in the purines biosynthetic pathway. Catalyzes the ATP-dependent conversion of formylglycinamide ribonucleotide (FGAR) and glutamine to yield formylglycinamidine ribonucleotide (FGAM) and glutamate. {ECO:0000305|PubMed:10548741}..,,,,,,UniProt
uniprot-O15078,protein,Centrosomal protein of 290 kDa (Cep290) (Bardet-Biedl syndrome 14 protein) (Cancer/testis antigen 87) (CT87) (Nephrocystin-6) (Tumor antigen se2-2),"Gene: CEP290. Organism: Homo sapiens (Human). Function: FUNCTION: Involved in early and late steps in cilia formation. Its association with CCP110 is required for inhibition of primary cilia formation by CCP110 (PubMed:18694559). May play a role in early ciliogenesis in the disappearance of centriolar satellites and in the transition of primary ciliar vesicles (PCVs) to capped ciliary vesicles (CCVs). Required for the centrosomal recruitment of RAB8A and for the targeting of centriole satellite proteins to centrosomes such as of PCM1 (PubMed:24421332). Required for the correct localization of ciliary and phototransduction proteins in retinal photoreceptor cells; may play a role in ciliary transport processes (By similarity). Required for efficient recruitment of RAB8A to primary cilium (PubMed:17705300). In the ciliary transition zone is part of the tectonic-like complex which is required for tissue-specific ciliogenesis and may regulate ciliary membrane composition (By similarity). Involved in regulation of the BBSome complex integrity, specifically for presence of BBS2, BBS5 and BBS8/TTC8 in the complex, and in ciliary targeting of selected BBSome cargos. May play a role in controlling entry of the BBSome complex to cilia possibly implicating IQCB1/NPHP5 (PubMed:25552655). Activates ATF4-mediated transcription (PubMed:16682973). {ECO:0000250|UniProtKB:Q6A078, ECO:0000269|PubMed:16682973, ECO:0000269|PubMed:17705300, ECO:0000269|PubMed:18694559, ECO:0000269|PubMed:24421332, ECO:0000269|PubMed:25552655}..",,,,,,UniProt
uniprot-O15111,protein,Inhibitor of nuclear factor kappa-B kinase subunit alpha (I-kappa-B kinase alpha) (IKK-A) (IKK-alpha) (IkBKA) (IkappaB kinase) (EC 2.7.11.10) (Conserved helix-loop-helix ubiquitous kinase) (I-kappa-B kinase 1) (IKK-1) (IKK1) (Nuclear factor NF-kappa-B inhibitor kinase alpha) (NFKBIKA) (Transcription factor 16) (TCF-16),"Gene: CHUK. Organism: Homo sapiens (Human). Function: FUNCTION: Serine kinase that plays an essential role in the NF-kappa-B signaling pathway which is activated by multiple stimuli such as inflammatory cytokines, bacterial or viral products, DNA damages or other cellular stresses (PubMed:18626576, PubMed:9244310, PubMed:9252186, PubMed:9346484). Acts as a part of the canonical IKK complex in the conventional pathway of NF-kappa-B activation and phosphorylates inhibitors of NF-kappa-B on serine residues (PubMed:18626576, PubMed:35952808, PubMed:9244310, PubMed:9252186, PubMed:9346484). These modifications allow polyubiquitination of the inhibitors and subsequent degradation by the proteasome (PubMed:18626576, PubMed:9244310, PubMed:9252186, PubMed:9346484). In turn, free NF-kappa-B is translocated into the nucleus and activates the transcription of hundreds of genes involved in immune response, growth control, or protection against apoptosis (PubMed:18626576, PubMed:9244310, PubMed:9252186, PubMed:9346484). Negatively regulates the pathway by phosphorylating the scaffold protein TAXBP1 and thus promoting the assembly of the A20/TNFAIP3 ubiquitin-editing complex (composed of A20/TNFAIP3, TAX1BP1, and the E3 ligases ITCH and RNF11) (PubMed:21765415). Therefore, CHUK plays a key role in the negative feedback of NF-kappa-B canonical signaling to limit inflammatory gene activation. As part of the non-canonical pathway of NF-kappa-B activation, the MAP3K14-activated CHUK/IKKA homodimer phosphorylates NFKB2/p100 associated with RelB, inducing its proteolytic processing to NFKB2/p52 and the formation of NF-kappa-B RelB-p52 complexes (PubMed:20501937). In turn, these complexes regulate genes encoding molecules involved in B-cell survival and lymphoid organogenesis. Also participates in the negative feedback of the non-canonical NF-kappa-B signaling pathway by phosphorylating and destabilizing MAP3K14/NIK. Within the nucleus, phosphorylates CREBBP and consequently increases both its transcriptional and histone acetyltransferase activities (PubMed:17434128). Modulates chromatin accessibility at NF-kappa-B-responsive promoters by phosphorylating histones H3 at 'Ser-10' that are subsequently acetylated at 'Lys-14' by CREBBP (PubMed:12789342). Additionally, phosphorylates the CREBBP-interacting protein NCOA3. Also phosphorylates FOXO3 and may regulate this pro-apoptotic transcription factor (PubMed:15084260). Phosphorylates RIPK1 at 'Ser-25' which represses its kinase activity and consequently prevents TNF-mediated RIPK1-dependent cell death (By similarity). Phosphorylates AMBRA1 following mitophagy induction, promoting AMBRA1 interaction with ATG8 family proteins and its mitophagic activity (PubMed:30217973). {ECO:0000250|UniProtKB:Q60680, ECO:0000269|PubMed:12789342, ECO:0000269|PubMed:15084260, ECO:0000269|PubMed:17434128, ECO:0000269|PubMed:20434986, ECO:0000269|PubMed:20501937, ECO:0000269|PubMed:21765415, ECO:0000269|PubMed:30217973, ECO:0000269|PubMed:35952808, ECO:0000269|PubMed:9244310, ECO:0000269|PubMed:9252186, ECO:0000269|PubMed:9346484, ECO:0000303|PubMed:18626576}..",,,,,,UniProt
uniprot-O15116,protein,U6 snRNA-associated Sm-like protein LSm1 (Cancer-associated Sm-like) (Small nuclear ribonuclear CaSm),"Gene: LSM1. Organism: Homo sapiens (Human). Function: FUNCTION: Plays a role in the degradation of histone mRNAs, the only eukaryotic mRNAs that are not polyadenylated (PubMed:18172165). Probably also part of an LSm subunits-containing complex involved in the general process of mRNA degradation (By similarity). {ECO:0000250|UniProtKB:P47017, ECO:0000269|PubMed:18172165}..",,,,,,UniProt
uniprot-O15119,protein,T-box transcription factor TBX3 (T-box protein 3),"Gene: TBX3. Organism: Homo sapiens (Human). Function: FUNCTION: Transcriptional repressor involved in developmental processes (PubMed:10468588). Binds to the palindromic T site 5'-TTCACACCTAGGTGTGAA-3' DNA sequence, or a half-site, which are present in the regulatory region of several genes (PubMed:12000749). Probably plays a role in limb pattern formation (PubMed:10468588). Required for mammary placode induction, and maintenance of the mammary buds during development (By similarity). Involved in branching morphogenesis in both developing lungs and adult mammary glands, via negative modulation of target genes; acting redundantly with TBX2 (By similarity). Required, together with TBX2, to maintain cell proliferation in the embryonic lung mesenchyme; perhaps acting downstream of SHH, BMP and TGFbeta signaling (By similarity). Involved in modulating early inner ear development, acting independently of, and also redundantly with, TBX2 in different subregions of the developing ear (By similarity). Acts as a negative regulator of PML function in cellular senescence (PubMed:22002537). {ECO:0000250|UniProtKB:P70324, ECO:0000269|PubMed:10468588, ECO:0000269|PubMed:12000749, ECO:0000269|PubMed:22002537}..",,,,,,UniProt
uniprot-O15120,protein,1-acyl-sn-glycerol-3-phosphate acyltransferase beta (EC 2.3.1.51) (1-acylglycerol-3-phosphate O-acyltransferase 2) (1-AGP acyltransferase 2) (1-AGPAT 2) (Lysophosphatidic acid acyltransferase beta) (LPAAT-beta),"Gene: AGPAT2. Organism: Homo sapiens (Human). Function: FUNCTION: Converts 1-acyl-sn-glycerol-3-phosphate (lysophosphatidic acid or LPA) into 1,2-diacyl-sn-glycerol-3-phosphate (phosphatidic acid or PA) by incorporating an acyl moiety at the sn-2 position of the glycerol backbone. {ECO:0000269|PubMed:15629135, ECO:0000269|PubMed:19075029, ECO:0000269|PubMed:21873652, ECO:0000269|PubMed:9242711}..",,,,,,UniProt
uniprot-O15127,protein,Secretory carrier-associated membrane protein 2 (Secretory carrier membrane protein 2),Gene: SCAMP2. Organism: Homo sapiens (Human). Function: FUNCTION: Functions in post-Golgi recycling pathways. Acts as a recycling carrier to the cell surface..,,,,,,UniProt
uniprot-O15156,protein,Zinc finger and BTB domain-containing protein 7B (Krueppel-related zinc finger protein cKrox) (hcKrox) (T-helper-inducing POZ/Krueppel-like factor) (Zinc finger and BTB domain-containing protein 15) (Zinc finger protein 67 homolog) (Zfp-67) (Zinc finger protein 857B) (Zinc finger protein Th-POK),"Gene: ZBTB7B. Organism: Homo sapiens (Human). Function: FUNCTION: Transcription regulator that acts as a key regulator of lineage commitment of immature T-cell precursors. Exerts distinct biological functions in the mammary epithelial cells and T cells in a tissue-specific manner. Necessary and sufficient for commitment of CD4 lineage, while its absence causes CD8 commitment. Development of immature T-cell precursors (thymocytes) to either the CD4 helper or CD8 killer T-cell lineages correlates precisely with their T-cell receptor specificity for major histocompatibility complex class II or class I molecules, respectively. Cross-antagonism between ZBTB7B and CBF complexes are determinative to CD4 versus CD8 cell fate decision. Suppresses RUNX3 expression and imposes CD4+ lineage fate by inducing the SOCS suppressors of cytokine signaling. induces, as a transcriptional activator, SOCS genes expression which represses RUNX3 expression and promotes the CD4+ lineage fate. During CD4 lineage commitment, associates with multiple sites at the CD8 locus, acting as a negative regulator of the CD8 promoter and enhancers by epigenetic silencing through the recruitment of class II histone deacetylases, such as HDAC4 and HDAC5, to these loci. Regulates the development of IL17-producing CD1d-restricted naural killer (NK) T cells. Also functions as an important metabolic regulator in the lactating mammary glands. Critical feed-forward regulator of insulin signaling in mammary gland lactation, directly regulates expression of insulin receptor substrate-1 (IRS-1) and insulin-induced Akt-mTOR-SREBP signaling (By similarity). Transcriptional repressor of the collagen COL1A1 and COL1A2 genes. May also function as a repressor of fibronectin and possibly other extracellular matrix genes (PubMed:9370309). Potent driver of brown fat development, thermogenesis and cold-induced beige fat formation. Recruits the brown fat lncRNA 1 (Blnc1):HNRNPU ribonucleoprotein complex to activate thermogenic gene expression in brown and beige adipocytes (By similarity). {ECO:0000250|UniProtKB:Q64321, ECO:0000269|PubMed:9370309}..",,,,,,UniProt
uniprot-O15162,protein,Phospholipid scramblase 1 (PL scramblase 1) (Ca(2+)-dependent phospholipid scramblase 1) (Erythrocyte phospholipid scramblase) (Mg(2+)-dependent nuclease) (EC 3.1.-.-) (MmTRA1b),"Gene: PLSCR1. Organism: Homo sapiens (Human). Function: FUNCTION: Catalyzes calcium-induced ATP-independent rapid bidirectional and non-specific movement of phospholipids (lipid scrambling or lipid flip-flop) between the inner and outer leaflet of the plasma membrane resulting in collapse of the phospholipid asymmetry which leads to phosphatidylserine externalization on the cell surface (PubMed:10770950, PubMed:18629440, PubMed:23590222, PubMed:23659204, PubMed:24343571, PubMed:24648509, PubMed:29748552, PubMed:32110987, PubMed:8663431, PubMed:9218461, PubMed:9485382, PubMed:9572851). Mediates calcium-dependent phosphatidylserine externalization and apoptosis in neurons via its association with TRPC5 (By similarity). Also exhibits magnesium-dependent nuclease activity against double-stranded DNA and RNA but not single-stranded DNA and can enhance DNA decatenation mediated by TOP2A (PubMed:17567603, PubMed:27206388). Negatively regulates FcR-mediated phagocytosis in differentiated macrophages (PubMed:26745724). May contribute to cytokine-regulated cell proliferation and differentiation (By similarity). May play a role in the antiviral response of interferon (IFN) by amplifying and enhancing the IFN response through increased expression of select subset of potent antiviral genes (PubMed:15308695). Inhibits the functions of viral transactivators, including human T-cell leukemia virus (HTLV)-1 protein Tax, human immunodeficiency virus (HIV)-1 Tat, human hepatitis B virus (HBV) HBx, Epstein-Barr virus (EBV) BZLF1 and human cytomegalovirus IE1 and IE2 proteins through direct interactions (PubMed:22789739, PubMed:23501106, PubMed:25365352, PubMed:31434743, PubMed:35138119). Also mediates the inhibition of influenza virus infection by preventing nuclear import of the viral nucleoprotein/NP (PubMed:29352288, PubMed:35595813). Plays a crucial role as a defense factor against SARS-CoV-2 independently of its scramblase activity by directly targeting nascent viral vesicles to prevent virus-membrane fusion and the release of viral RNA into the host-cell cytosol (PubMed:37438530). {ECO:0000250|UniProtKB:Q9JJ00, ECO:0000269|PubMed:10770950, ECO:0000269|PubMed:15308695, ECO:0000269|PubMed:17567603, ECO:0000269|PubMed:18629440, ECO:0000269|PubMed:21806988, ECO:0000269|PubMed:22789739, ECO:0000269|PubMed:23501106, ECO:0000269|PubMed:23590222, ECO:0000269|PubMed:23659204, ECO:0000269|PubMed:24343571, ECO:0000269|PubMed:24648509, ECO:0000269|PubMed:25365352, ECO:0000269|PubMed:26745724, ECO:0000269|PubMed:27206388, ECO:0000269|PubMed:29748552, ECO:0000269|PubMed:31434743, ECO:0000269|PubMed:32110987, ECO:0000269|PubMed:35138119, ECO:0000269|PubMed:37438530, ECO:0000269|PubMed:8663431, ECO:0000269|PubMed:9218461, ECO:0000269|PubMed:9485382, ECO:0000269|PubMed:9572851}.; FUNCTION: (Microbial infection) Acts as an attachment receptor for HCV. {ECO:0000269|PubMed:21806988}..",,,,,,UniProt
uniprot-O15169,protein,Axin-1 (Axis inhibition protein 1) (hAxin),"Gene: AXIN1. Organism: Homo sapiens (Human). Function: FUNCTION: Component of the beta-catenin destruction complex required for regulating CTNNB1 levels through phosphorylation and ubiquitination, and modulating Wnt-signaling (PubMed:12192039, PubMed:27098453, PubMed:28829046). Controls dorsoventral patterning via two opposing effects; down-regulates CTNNB1 to inhibit the Wnt signaling pathway and ventralize embryos, but also dorsalizes embryos by activating a Wnt-independent JNK signaling pathway (PubMed:12192039). In Wnt signaling, probably facilitates the phosphorylation of CTNNB1 and APC by GSK3B (PubMed:12192039). Likely to function as a tumor suppressor. Enhances TGF-beta signaling by recruiting the RNF111 E3 ubiquitin ligase and promoting the degradation of inhibitory SMAD7 (PubMed:16601693). Also a component of the AXIN1-HIPK2-TP53 complex which controls cell growth, apoptosis and development (PubMed:17210684). Facilitates the phosphorylation of TP53 by HIPK2 upon ultraviolet irradiation (PubMed:17210684). {ECO:0000269|PubMed:12192039, ECO:0000269|PubMed:16601693, ECO:0000269|PubMed:17210684, ECO:0000269|PubMed:27098453, ECO:0000269|PubMed:28546513}..",,,,,,UniProt
uniprot-O15230,protein,Laminin subunit alpha-5 (Laminin-10 subunit alpha) (Laminin-11 subunit alpha) (Laminin-15 subunit alpha),"Gene: LAMA5. Organism: Homo sapiens (Human). Function: FUNCTION: Binding to cells via a high affinity receptor, laminin is thought to mediate the attachment, migration and organization of cells into tissues during embryonic development by interacting with other extracellular matrix components. Plays a role in the regulation of skeletogenesis, through a mechanism that involves integrin-mediated signaling and PTK2B/PYK2 (PubMed:33242826). {ECO:0000269|PubMed:33242826}..",,,,,,UniProt
uniprot-O15232,protein,Matrilin-3,Gene: MATN3. Organism: Homo sapiens (Human). Function: FUNCTION: Major component of the extracellular matrix of cartilage and may play a role in the formation of extracellular filamentous networks..,,,,,,UniProt
