entity_id,entity_type,name,description,temperature_max,strength,conductivity,ph,salinity,source
uniprot-O43581,protein,Synaptotagmin-7 (IPCA-7) (Prostate cancer-associated protein 7) (Synaptotagmin VII) (SytVII),"Gene: SYT7. Organism: Homo sapiens (Human). Function: FUNCTION: Ca(2+) sensor involved in Ca(2+)-dependent exocytosis of secretory and synaptic vesicles through Ca(2+) and phospholipid binding to the C2 domain (By similarity). Ca(2+) induces binding of the C2-domains to phospholipid membranes and to assembled SNARE-complexes; both actions contribute to triggering exocytosis (By similarity). SYT7 binds Ca(2+) with high affinity and slow kinetics compared to other synaptotagmins (By similarity). Involved in Ca(2+)-triggered lysosomal exocytosis, a major component of the plasma membrane repair (PubMed:11342594). Ca(2+)-regulated delivery of lysosomal membranes to the cell surface is also involved in the phagocytic uptake of particles by macrophages (By similarity). Ca(2+)-triggered lysosomal exocytosis also plays a role in bone remodeling by regulating secretory pathways in osteoclasts and osteoblasts (By similarity). In case of infection, involved in participates cell invasion by Trypanosoma cruzi via Ca(2+)-triggered lysosomal exocytosis (PubMed:11342594, PubMed:15811535). Involved in cholesterol transport from lysosome to peroxisome by promoting membrane contacts between lysosomes and peroxisomes: probably acts by promoting vesicle fusion by binding phosphatidylinositol-4,5-bisphosphate on peroxisomal membranes (By similarity). Acts as a key mediator of synaptic facilitation, a process also named short-term synaptic potentiation: synaptic facilitation takes place at synapses with a low initial release probability and is caused by influx of Ca(2+) into the axon terminal after spike generation, increasing the release probability of neurotransmitters (By similarity). Probably mediates synaptic facilitation by directly increasing the probability of release (By similarity). May also contribute to synaptic facilitation by regulating synaptic vesicle replenishment, a process required to ensure that synaptic vesicles are ready for the arrival of the next action potential: SYT7 is required for synaptic vesicle replenishment by acting as a sensor for Ca(2+) and by forming a complex with calmodulin (By similarity). Also acts as a regulator of Ca(2+)-dependent insulin and glucagon secretion in beta-cells (By similarity). Triggers exocytosis by promoting fusion pore opening and fusion pore expansion in chromaffin cells (By similarity). Also regulates the secretion of some non-synaptic secretory granules of specialized cells (By similarity). {ECO:0000250|UniProtKB:Q62747, ECO:0000250|UniProtKB:Q9R0N7, ECO:0000269|PubMed:11342594, ECO:0000269|PubMed:15811535}..",,,,,,UniProt
uniprot-O43593,protein,Lysine-specific demethylase hairless (EC 1.14.11.65) ([histone H3]-dimethyl-L-lysine(9) demethylase hairless),"Gene: HR. Organism: Homo sapiens (Human). Function: FUNCTION: Histone demethylase that specifically demethylates both mono- and dimethylated 'Lys-9' of histone H3. May act as a transcription regulator controlling hair biology (via targeting of collagens), neural activity, and cell cycle. {ECO:0000269|PubMed:24334705}..",,,,,,UniProt
uniprot-O43598,protein,5-hydroxymethyl-dUMP N-hydrolase (EC 3.2.2.-) (2'-deoxynucleoside 5'-phosphate N-hydrolase 1) (c-Myc-responsive protein RCL),"Gene: DNPH1. Organism: Homo sapiens (Human). Function: FUNCTION: Part of a nucleotide salvage pathway that eliminates epigenetically modified 5-hydroxymethyl-dCMP (hmdCMP) in a two-step process entailing deamination to cytotoxic 5-hydroxymethyl-dUMP (hmdUMP), followed by its hydrolysis into 5-hydroxymethyluracil (hmU) and 2-deoxy-D-ribose 5-phosphate (deoxyribosephosphate) (PubMed:33833118). Catalyzes the second step in that pathway, the hydrolysis of the N-glycosidic bond in hmdUMP, degrading this cytotoxic nucleotide to avoid its genomic integration (PubMed:33833118). {ECO:0000269|PubMed:33833118}..",,,,,,UniProt
uniprot-O43603,protein,Galanin receptor type 2 (GAL2-R) (GALR-2),"Gene: GALR2. Organism: Homo sapiens (Human). Function: FUNCTION: Receptor for the hormone galanin and GALP. Receptor for the hormone spexin-1 (PubMed:24517231). The activity of this receptor is mediated by G proteins that activate the phospholipase C/protein kinase C pathway (via G(q)) and that inhibit adenylyl cyclase (via G(i)). {ECO:0000269|PubMed:24517231, ECO:0000269|PubMed:25691535, ECO:0000269|PubMed:9480833, ECO:0000269|PubMed:9685625, ECO:0000269|PubMed:9832121, ECO:0000269|PubMed:9880084}..",,,,,,UniProt
uniprot-O43609,protein,Protein sprouty homolog 1 (Spry-1),"Gene: SPRY1. Organism: Homo sapiens (Human). Function: FUNCTION: Inhibits fibroblast growth factor (FGF)-induced retinal lens fiber differentiation, probably by inhibiting FGF-mediated phosphorylation of ERK1/2 (By similarity). Inhibits TGFB-induced epithelial-to-mesenchymal transition in lens epithelial cells (By similarity). {ECO:0000250|UniProtKB:Q9QXV9}..",,,,,,UniProt
uniprot-O43715,protein,TP53-regulated inhibitor of apoptosis 1 (Protein 15E1.1) (WF-1) (p53-inducible cell-survival factor) (p53CSV),"Gene: TRIAP1. Organism: Homo sapiens (Human). Function: FUNCTION: Involved in the modulation of the mitochondrial apoptotic pathway by ensuring the accumulation of cardiolipin (CL) in mitochondrial membranes. In vitro, the TRIAP1:PRELID1 complex mediates the transfer of phosphatidic acid (PA) between liposomes and probably functions as a PA transporter across the mitochondrion intermembrane space to provide PA for CL synthesis in the inner membrane (PubMed:23931759). Likewise, the TRIAP1:PRELID3A complex mediates the transfer of phosphatidic acid (PA) between liposomes (in vitro) and probably functions as a PA transporter across the mitochondrion intermembrane space (in vivo) (PubMed:26071602). Mediates cell survival by inhibiting activation of caspase-9 which prevents induction of apoptosis (PubMed:15735003). {ECO:0000269|PubMed:15735003, ECO:0000269|PubMed:23931759, ECO:0000269|PubMed:26071602}..",,,,,,UniProt
uniprot-O43719,protein,17S U2 SnRNP complex component HTATSF1 (HIV Tat-specific factor 1) (Tat-SF1),"Gene: HTATSF1. Organism: Homo sapiens (Human). Function: FUNCTION: Component of the 17S U2 SnRNP complex of the spliceosome, a large ribonucleoprotein complex that removes introns from transcribed pre-mRNAs (PubMed:30567737, PubMed:32494006, PubMed:34822310). The 17S U2 SnRNP complex (1) directly participates in early spliceosome assembly and (2) mediates recognition of the intron branch site during pre-mRNA splicing by promoting the selection of the pre-mRNA branch-site adenosine, the nucleophile for the first step of splicing (PubMed:30567737, PubMed:32494006, PubMed:34822310). Within the 17S U2 SnRNP complex, HTATSF1 is required to stabilize the branchpoint-interacting stem loop (PubMed:34822310). HTATSF1 is displaced from the 17S U2 SnRNP complex before the stable addition of the 17S U2 SnRNP complex to the spliceosome, destabilizing the branchpoint-interacting stem loop and allowing to probe intron branch site sequences (PubMed:32494006, PubMed:34822310). Also acts as a regulator of transcriptional elongation, possibly by mediating the reciprocal stimulatory effect of splicing on transcriptional elongation (PubMed:10454543, PubMed:10913173, PubMed:11780068). Involved in double-strand break (DSB) repair via homologous recombination in S-phase by promoting the recruitment of TOPBP1 to DNA damage sites (PubMed:35597237). Mechanistically, HTATSF1 is (1) recruited to DNA damage sites in S-phase via interaction with poly-ADP-ribosylated RPA1 and (2) phosphorylated by CK2, promoting recruitment of TOPBP1, thereby facilitating RAD51 nucleofilaments formation and RPA displacement, followed by homologous recombination (PubMed:35597237). {ECO:0000269|PubMed:10454543, ECO:0000269|PubMed:10913173, ECO:0000269|PubMed:11780068, ECO:0000269|PubMed:30567737, ECO:0000269|PubMed:32494006, ECO:0000269|PubMed:34822310, ECO:0000269|PubMed:35597237}.; FUNCTION: (Microbial infection) In case of infection by HIV-1, it is up-regulated by the HIV-1 proteins NEF and gp120, acts as a cofactor required for the Tat-enhanced transcription of the virus. {ECO:0000269|PubMed:10393184, ECO:0000269|PubMed:11420046, ECO:0000269|PubMed:15905670, ECO:0000269|PubMed:8849451, ECO:0000269|PubMed:9765201}..",,,,,,UniProt
uniprot-O43761,protein,Synaptogyrin-3,Gene: SYNGR3. Organism: Homo sapiens (Human). Function: FUNCTION: May play a role in regulated exocytosis. May indirectly regulate the activity of the plasma membrane dopamine transporter SLC6A3 and thereby regulate dopamine transport back from the synaptic cleft into the presynaptic terminal. {ECO:0000250|UniProtKB:Q8R191}..,,,,,,UniProt
uniprot-O43763,protein,T-cell leukemia homeobox protein 2 (Homeobox protein Hox-11L1) (Neural crest homeobox protein),"Gene: TLX2. Organism: Homo sapiens (Human). Function: FUNCTION: Transcription activator that binds DNA elements with the consensus sequence 5'-CGGTAATTGG-3'. Binds DNA via its homeobox. Required for normal cell death of enteric neurons in the gastrointestinal tract. Required for normal development of the enteric nervous system, and for proper development of normal motility of the gastrointestinal tract (By similarity). {ECO:0000250}..",,,,,,UniProt
uniprot-O43808,protein,Peroxisomal membrane protein PMP34 (34 kDa peroxisomal membrane protein) (Solute carrier family 25 member 17),"Gene: SLC25A17. Organism: Homo sapiens (Human). Function: FUNCTION: Peroxisomal transporter for multiple cofactors like coenzyme A (CoA), flavin adenine dinucleotide (FAD), flavin mononucleotide (FMN) and nucleotide adenosine monophosphate (AMP), and to a lesser extent for nicotinamide adenine dinucleotide (NAD(+)), adenosine diphosphate (ADP) and adenosine 3',5'-diphosphate (PAP). May catalyze the transport of free CoA, FAD and NAD(+) from the cytosol into the peroxisomal matrix by a counter-exchange mechanism. {ECO:0000269|PubMed:22185573}..",,,,,,UniProt
uniprot-O43818,protein,U3 small nucleolar RNA-interacting protein 2 (RRP9 homolog) (U3 small nucleolar ribonucleoprotein-associated 55 kDa protein) (U3 snoRNP-associated 55 kDa protein) (U3-55K),"Gene: RRP9. Organism: Homo sapiens (Human). Function: FUNCTION: Component of a nucleolar small nuclear ribonucleoprotein particle (snoRNP) thought to participate in the processing and modification of pre-ribosomal RNA (pre-rRNA) (PubMed:26867678). Part of the small subunit (SSU) processome, first precursor of the small eukaryotic ribosomal subunit. During the assembly of the SSU processome in the nucleolus, many ribosome biogenesis factors, an RNA chaperone and ribosomal proteins associate with the nascent pre-rRNA and work in concert to generate RNA folding, modifications, rearrangements and cleavage as well as targeted degradation of pre-ribosomal RNA by the RNA exosome (PubMed:34516797). {ECO:0000269|PubMed:26867678, ECO:0000269|PubMed:34516797}..",,,,,,UniProt
uniprot-O43823,protein,A-kinase anchor protein 8 (AKAP-8) (A-kinase anchor protein 95 kDa) (AKAP 95),"Gene: AKAP8. Organism: Homo sapiens (Human). Function: FUNCTION: Anchoring protein that mediates the subcellular compartmentation of cAMP-dependent protein kinase (PKA type II) (PubMed:9473338). Acts as an anchor for a PKA-signaling complex onto mitotic chromosomes, which is required for maintenance of chromosomes in a condensed form throughout mitosis. Recruits condensin complex subunit NCAPD2 to chromosomes required for chromatin condensation; the function appears to be independent from PKA-anchoring (PubMed:10601332, PubMed:10791967, PubMed:11964380). May help to deliver cyclin D/E to CDK4 to facilitate cell cycle progression (PubMed:14641107). Required for cell cycle G2/M transition and histone deacetylation during mitosis. In mitotic cells recruits HDAC3 to the vicinity of chromatin leading to deacetylation and subsequent phosphorylation at 'Ser-10' of histone H3; in this function may act redundantly with AKAP8L (PubMed:16980585). Involved in nuclear retention of RPS6KA1 upon ERK activation thus inducing cell proliferation (PubMed:22130794). May be involved in regulation of DNA replication by acting as scaffold for MCM2 (PubMed:12740381). Enhances HMT activity of the KMT2 family MLL4/WBP7 complex and is involved in transcriptional regulation. In a teratocarcinoma cell line is involved in retinoic acid-mediated induction of developmental genes implicating H3 'Lys-4' methylation (PubMed:23995757). May be involved in recruitment of active CASP3 to the nucleus in apoptotic cells (PubMed:16227597). May act as a carrier protein of GJA1 for its transport to the nucleus (PubMed:26880274). May play a repressive role in the regulation of rDNA transcription. Preferentially binds GC-rich DNA in vitro. In cells, associates with ribosomal RNA (rRNA) chromatin, preferentially with rRNA promoter and transcribed regions (PubMed:26683827). Involved in modulation of Toll-like receptor signaling. Required for the cAMP-dependent suppression of TNF in early stages of LPS-induced macrophage activation; the function probably implicates targeting of PKA to NFKB1 (By similarity). {ECO:0000250|UniProtKB:Q63014, ECO:0000250|UniProtKB:Q9DBR0, ECO:0000269|PubMed:10601332, ECO:0000269|PubMed:10791967, ECO:0000269|PubMed:11964380, ECO:0000269|PubMed:16980585, ECO:0000269|PubMed:22130794, ECO:0000269|PubMed:26683827, ECO:0000269|PubMed:26880274, ECO:0000305|PubMed:14641107, ECO:0000305|PubMed:9473338}..",,,,,,UniProt
uniprot-O43825,protein,"Beta-1,3-galactosyltransferase 2 (Beta-1,3-GalTase 2) (Beta3Gal-T2) (Beta3GalT2) (EC 2.4.1.86) (UDP-galactose:2-acetamido-2-deoxy-D-glucose 3beta-galactosyltransferase 2)","Gene: B3GALT2. Organism: Homo sapiens (Human). Function: FUNCTION: Beta-1,3-galactosyltransferase that transfers galactose from UDP-galactose to substrates with a terminal beta-N-acetylglucosamine (beta-GlcNAc) residue. Can also utilize substrates with a terminal galactose residue, albeit with lower efficiency. Involved in the biosynthesis of the carbohydrate moieties of glycolipids and glycoproteins. Inactive towards substrates with terminal alpha-N-acetylglucosamine (alpha-GlcNAc) or alpha-N-acetylgalactosamine (alpha-GalNAc) residues. {ECO:0000269|PubMed:9417100, ECO:0000269|PubMed:9582303}..",,,,,,UniProt
uniprot-O43826,protein,Glucose-6-phosphate exchanger SLC37A4 (Glucose-5-phosphate transporter) (Glucose-6-phosphate translocase) (Solute carrier family 37 member 4) (Transformation-related gene 19 protein) (TRG-19),"Gene: SLC37A4. Organism: Homo sapiens (Human). Function: FUNCTION: Inorganic phosphate and glucose-6-phosphate antiporter of the endoplasmic reticulum. Transports cytoplasmic glucose-6-phosphate into the lumen of the endoplasmic reticulum and translocates inorganic phosphate into the opposite direction (PubMed:33964207). Forms with glucose-6-phosphatase the complex responsible for glucose production through glycogenolysis and gluconeogenesis. Hence, it plays a central role in homeostatic regulation of blood glucose levels. {ECO:0000269|PubMed:10026167, ECO:0000269|PubMed:21949678, ECO:0000269|PubMed:33964207}..",,,,,,UniProt
uniprot-O43827,protein,Angiopoietin-related protein 7 (Angiopoietin-like factor) (Angiopoietin-like protein 7) (Cornea-derived transcript 6 protein),"Gene: ANGPTL7. Organism: Homo sapiens (Human). Function: FUNCTION: Has a role in the formation and organization of the extracellular matrix. In the eye, it functions as a mediator of dexamethasone-induced matrix deposition in the trabecular meshwork, the tissue responsible for the outflow of the ocular aqueous humor and for the maintenance of intraocular pressure (PubMed:21199193). Is a negative regulator of angiogenesis in the cornea, and plays a major role in maintaining corneal avascularity and transparency (PubMed:25622036). {ECO:0000269|PubMed:21199193, ECO:0000269|PubMed:25622036}..",,,,,,UniProt
uniprot-O43854,protein,EGF-like repeat and discoidin I-like domain-containing protein 3 (Developmentally-regulated endothelial cell locus 1 protein) (Integrin-binding protein DEL1),Gene: EDIL3. Organism: Homo sapiens (Human). Function: FUNCTION: Promotes adhesion of endothelial cells through interaction with the alpha-v/beta-3 integrin receptor. Inhibits formation of vascular-like structures. May be involved in regulation of vascular morphogenesis of remodeling in embryonic development..,,,,,,UniProt
uniprot-O43865,protein,S-adenosylhomocysteine hydrolase-like protein 1 (DC-expressed AHCY-like molecule) (IP(3)Rs binding protein released with IP(3)) (IRBIT) (Putative adenosylhomocysteinase 2) (S-adenosyl-L-homocysteine hydrolase 2) (AdoHcyase 2),"Gene: AHCYL1. Organism: Homo sapiens (Human). Function: FUNCTION: Multifaceted cellular regulator which coordinates several essential cellular functions including regulation of epithelial HCO3(-) and fluid secretion, mRNA processing and DNA replication. Regulates ITPR1 sensitivity to inositol 1,4,5-trisphosphate, competing for the common binding site and acting as endogenous 'pseudoligand' whose inhibitory activity can be modulated by its phosphorylation status. Promotes the formation of contact points between the endoplasmic reticulum (ER) and mitochondria, facilitating transfer of Ca(2+) from the ER to mitochondria (PubMed:27995898). Under normal cellular conditions, functions cooperatively with BCL2L10 to limit ITPR1-mediated Ca(2+) release but, under apoptotic stress conditions, dephosphorylated which promotes dissociation of both AHCYL1 and BCL2L10 from mitochondria-associated endoplasmic reticulum membranes, inhibits BCL2L10 interaction with ITPR1 and leads to increased Ca(2+) transfer to mitochondria which promotes apoptosis (PubMed:27995898). In the pancreatic and salivary ducts, at resting state, attenuates inositol 1,4,5-trisphosphate-induced calcium release by interacting with ITPR1 (PubMed:16793548). When extracellular stimuli induce ITPR1 phosphorylation or inositol 1,4,5-trisphosphate production, dissociates from ITPR1 to interact with CFTR and SLC26A6, mediating their synergistic activation by calcium and cAMP that stimulates the epithelial secretion of electrolytes and fluid (By similarity). Also activates basolateral SLC4A4 isoform 1 to coordinate fluid and HCO3(-) secretion (PubMed:16769890). Inhibits the effect of STK39 on SLC4A4 and CFTR by recruiting PP1 phosphatase which activates SLC4A4, SLC26A6 and CFTR through dephosphorylation (By similarity). Mediates the induction of SLC9A3 surface expression produced by Angiotensin-2 (PubMed:20584908). Depending on the cell type, activates SLC9A3 in response to calcium or reverses SLC9A3R2-dependent calcium inhibition (PubMed:18829453). May modulate the polyadenylation state of specific mRNAs, both by controlling the subcellular location of FIP1L1 and by inhibiting PAPOLA activity, in response to a stimulus that alters its phosphorylation state (PubMed:19224921). Acts as a (dATP)-dependent inhibitor of ribonucleotide reductase large subunit RRM1, controlling the endogenous dNTP pool and ensuring normal cell cycle progression (PubMed:25237103). In vitro does not exhibit any S-adenosyl-L-homocysteine hydrolase activity (By similarity). {ECO:0000250|UniProtKB:B5DFN2, ECO:0000250|UniProtKB:Q80SW1, ECO:0000269|PubMed:16769890, ECO:0000269|PubMed:16793548, ECO:0000269|PubMed:18829453, ECO:0000269|PubMed:19224921, ECO:0000269|PubMed:20584908, ECO:0000269|PubMed:25237103, ECO:0000269|PubMed:27995898}..",,,,,,UniProt
uniprot-O43866,protein,CD5 antigen-like (Apoptosis inhibitor expressed by macrophages) (hAIM) (CT-2) (IgM-associated peptide) (SP-alpha),"Gene: CD5L. Organism: Homo sapiens (Human). Function: FUNCTION: Secreted protein that acts as a key regulator of lipid synthesis: mainly expressed by macrophages in lymphoid and inflamed tissues and regulates mechanisms in inflammatory responses, such as infection or atherosclerosis. Able to inhibit lipid droplet size in adipocytes. Following incorporation into mature adipocytes via CD36-mediated endocytosis, associates with cytosolic FASN, inhibiting fatty acid synthase activity and leading to lipolysis, the degradation of triacylglycerols into glycerol and free fatty acids (FFA). CD5L-induced lipolysis occurs with progression of obesity: participates in obesity-associated inflammation following recruitment of inflammatory macrophages into adipose tissues, a cause of insulin resistance and obesity-related metabolic disease. Regulation of intracellular lipids mediated by CD5L has a direct effect on transcription regulation mediated by nuclear receptors ROR-gamma (RORC). Acts as a key regulator of metabolic switch in T-helper Th17 cells. Regulates the expression of pro-inflammatory genes in Th17 cells by altering the lipid content and limiting synthesis of cholesterol ligand of RORC, the master transcription factor of Th17-cell differentiation. CD5L is mainly present in non-pathogenic Th17 cells, where it decreases the content of polyunsaturated fatty acyls (PUFA), affecting two metabolic proteins MSMO1 and CYP51A1, which synthesize ligands of RORC, limiting RORC activity and expression of pro-inflammatory genes. Participates in obesity-associated autoimmunity via its association with IgM, interfering with the binding of IgM to Fcalpha/mu receptor and enhancing the development of long-lived plasma cells that produce high-affinity IgG autoantibodies (By similarity). Also acts as an inhibitor of apoptosis in macrophages: promotes macrophage survival from the apoptotic effects of oxidized lipids in case of atherosclerosis (PubMed:24295828). Involved in early response to microbial infection against various pathogens by acting as a pattern recognition receptor and by promoting autophagy (PubMed:16030018, PubMed:24223991, PubMed:24583716, PubMed:25713983). Promotes recovery from acute kidney injury (AKI) by accumulating on necrotic cell debris within the kidney proximal tubules following AKI and interacting with HAVCR1 expressed on the surface of injured kidney tubular epithelial cells (PubMed:26726878). This enhances HAVCR1-mediated phagocytosis of intraluminal necrotic debris and contributes to kidney tissue repair (PubMed:26726878). Also enhances necrotic debris uptake by kidney macrophages in a HAVCR1-independent manner (By similarity). {ECO:0000250|UniProtKB:Q9QWK4, ECO:0000269|PubMed:16030018, ECO:0000269|PubMed:24223991, ECO:0000269|PubMed:24295828, ECO:0000269|PubMed:24583716, ECO:0000269|PubMed:25713983, ECO:0000269|PubMed:26726878}..",,,,,,UniProt
uniprot-O43868,protein,Sodium/nucleoside cotransporter 2 (Concentrative nucleoside transporter 2) (CNT 2) (hCNT2) (Na(+)/nucleoside cotransporter 2) (Sodium-coupled nucleoside transporter 2) (Sodium/purine nucleoside co-transporter) (SPNT) (Solute carrier family 28 member 2),"Gene: SLC28A2. Organism: Homo sapiens (Human). Function: FUNCTION: Sodium-dependent and purine-selective transporter (PubMed:10087507, PubMed:9435697). Exhibits the transport characteristics of the nucleoside transport system cif or N1 subtype (N1/cif) (selective for purine nucleosides and uridine) (PubMed:10087507, PubMed:21795683, PubMed:9435697). Plays a critical role in specific uptake and salvage of purine nucleosides in kidney and other tissues (PubMed:9435697). May contribute to regulate the transport of organic compounds in testes across the blood-testis-barrier (Probable). {ECO:0000269|PubMed:10087507, ECO:0000269|PubMed:21795683, ECO:0000269|PubMed:9435697, ECO:0000305|PubMed:35307651}..",,,,,,UniProt
uniprot-O43897,protein,Tolloid-like protein 1 (EC 3.4.24.-),"Gene: TLL1. Organism: Homo sapiens (Human). Function: FUNCTION: Protease which processes procollagen C-propeptides, such as chordin, pro-biglycan and pro-lysyl oxidase. Required for the embryonic development. Predominant protease, which in the development, influences dorsal-ventral patterning and skeletogenesis..",,,,,,UniProt
uniprot-O43903,protein,Growth arrest-specific protein 2 (GAS-2),"Gene: GAS2. Organism: Homo sapiens (Human). Function: FUNCTION: Required to maintain microtubule bundles in inner ear supporting cells, affording them with mechanical stiffness to transmit sound energy through the cochlea. {ECO:0000250|UniProtKB:P11862}..",,,,,,UniProt
uniprot-O43913,protein,Origin recognition complex subunit 5,Gene: ORC5. Organism: Homo sapiens (Human). Function: FUNCTION: Component of the origin recognition complex (ORC) that binds origins of replication. DNA-binding is ATP-dependent. The specific DNA sequences that define origins of replication have not been identified yet. ORC is required to assemble the pre-replication complex necessary to initiate DNA replication. {ECO:0000269|PubMed:31160578}..,,,,,,UniProt
