entity_id,entity_type,name,description,temperature_max,strength,conductivity,ph,salinity,source
uniprot-O00487,protein,Ubiquitin C-terminal hydrolase PSMD14 (EC 3.4.19.12) (26S proteasome non-ATPase regulatory subunit 14) (26S proteasome regulatory subunit RPN11) (26S proteasome-associated PAD1 homolog 1),"Gene: PSMD14. Organism: Homo sapiens (Human). Function: FUNCTION: Component of the 26S proteasome, a multiprotein complex involved in the ATP-dependent degradation of ubiquitinated proteins. This complex plays a key role in the maintenance of protein homeostasis by removing misfolded or damaged proteins, which could impair cellular functions, and by removing proteins whose functions are no longer required. Therefore, the proteasome participates in numerous cellular processes, including cell cycle progression, apoptosis, or DNA damage repair (PubMed:9374539, PubMed:1317798). The PSMD14 subunit is a metalloprotease that specifically cleaves 'Lys-63'-linked polyubiquitin chains within the complex (PubMed:22909820). Plays a role in response to double-strand breaks (DSBs): acts as a regulator of non-homologous end joining (NHEJ) by cleaving 'Lys-63'-linked polyubiquitin, thereby promoting retention of JMJD2A/KDM4A on chromatin and restricting TP53BP1 accumulation (PubMed:22909820). Also involved in homologous recombination repair by promoting RAD51 loading (PubMed:22909820). Regulates macroautophagy by ensuring Golgi-to-ER retrograde transport through its deubiquitinating activity on K63-linked ubiquitin chains. This activity prevents the retention of essential autophagy proteins at the Golgi, enabling their trafficking to autophagosome formation sites and supporting Golgi-ER membrane recycling critical for effective autophagy (PubMed:32210007). {ECO:0000269|PubMed:1317798, ECO:0000269|PubMed:22909820, ECO:0000269|PubMed:32210007, ECO:0000269|PubMed:9374539}..",,,,,,UniProt
uniprot-O00505,protein,Importin subunit alpha-4 (Importin alpha Q2) (Qip2) (Karyopherin subunit alpha-3) (SRP1-gamma),"Gene: KPNA3. Organism: Homo sapiens (Human). Function: FUNCTION: Functions in nuclear protein import as an adapter protein for nuclear receptor KPNB1. Binds specifically and directly to substrates containing either a simple or bipartite NLS motif. Docking of the importin/substrate complex to the nuclear pore complex (NPC) is mediated by KPNB1 through binding to nucleoporin FxFG repeats and the complex is subsequently translocated through the pore by an energy requiring, Ran-dependent mechanism. At the nucleoplasmic side of the NPC, Ran binds to importin-beta and the three components separate and importin-alpha and -beta are re-exported from the nucleus to the cytoplasm where GTP hydrolysis releases Ran from importin. The directionality of nuclear import is thought to be conferred by an asymmetric distribution of the GTP- and GDP-bound forms of Ran between the cytoplasm and nucleus. In vitro, mediates the nuclear import of human cytomegalovirus UL84 by recognizing a non-classical NLS. Recognizes NLSs of influenza A virus nucleoprotein probably through ARM repeats 7-9..",,,,,,UniProt
uniprot-O00506,protein,Serine/threonine-protein kinase 25 (EC 2.7.11.1) (Ste20-like kinase) (Sterile 20/oxidant stress-response kinase 1) (SOK-1) (Ste20/oxidant stress response kinase 1),"Gene: STK25. Organism: Homo sapiens (Human). Function: FUNCTION: Oxidant stress-activated serine/threonine kinase that may play a role in the response to environmental stress. Targets to the Golgi apparatus where it appears to regulate protein transport events, cell adhesion, and polarity complexes important for cell migration. Part of the striatin-interacting phosphatase and kinase (STRIPAK) complexes. STRIPAK complexes have critical roles in protein (de)phosphorylation and are regulators of multiple signaling pathways including Hippo, MAPK, nuclear receptor and cytoskeleton remodeling. Different types of STRIPAK complexes are involved in a variety of biological processes such as cell growth, differentiation, apoptosis, metabolism and immune regulation (PubMed:18782753). {ECO:0000269|PubMed:15037601, ECO:0000269|PubMed:18782753}..",,,,,,UniProt
uniprot-O00507,protein,"Ubiquitin carboxyl-terminal hydrolase 9Y (EC 3.4.19.12) (Deubiquitinating enzyme FAF-Y) (Fat facets protein-related, Y-linked) (Ubiquitin thioesterase FAF-Y) (Ubiquitin-specific protease 9, Y chromosome) (Ubiquitin-specific-processing protease FAF-Y)",Gene: USP9Y. Organism: Homo sapiens (Human). Function: FUNCTION: Deubiquitinase that mediates deubiquitination of target proteins (PubMed:12895410). May stabilize target proteins that are important for male germ cell development (PubMed:12895410). {ECO:0000269|PubMed:12895410}..,,,,,,UniProt
uniprot-O00560,protein,Syntenin-1 (Melanoma differentiation-associated protein 9) (MDA-9) (Pro-TGF-alpha cytoplasmic domain-interacting protein 18) (TACIP18) (Scaffold protein Pbp1) (Syndecan-binding protein 1),"Gene: SDCBP. Organism: Homo sapiens (Human). Function: FUNCTION: Multifunctional adapter protein involved in diverse array of functions including trafficking of transmembrane proteins, neuro and immunomodulation, exosome biogenesis, and tumorigenesis (PubMed:26291527). Positively regulates TGFB1-mediated SMAD2/3 activation and TGFB1-induced epithelial-to-mesenchymal transition (EMT) and cell migration in various cell types. May increase TGFB1 signaling by enhancing cell-surface expression of TGFR1 by preventing the interaction between TGFR1 and CAV1 and subsequent CAV1-dependent internalization and degradation of TGFR1 (PubMed:25893292). In concert with SDC1/4 and PDCD6IP, regulates exosome biogenesis (PubMed:22660413). Regulates migration, growth, proliferation, and cell cycle progression in a variety of cancer types (PubMed:26539120). In adherens junctions may function to couple syndecans to cytoskeletal proteins or signaling components. Seems to couple transcription factor SOX4 to the IL-5 receptor (IL5RA) (PubMed:11498591). May also play a role in vesicular trafficking (PubMed:11179419). Seems to be required for the targeting of TGFA to the cell surface in the early secretory pathway (PubMed:10230395). {ECO:0000269|PubMed:10230395, ECO:0000269|PubMed:11179419, ECO:0000269|PubMed:11498591, ECO:0000269|PubMed:22660413, ECO:0000269|PubMed:25893292, ECO:0000269|PubMed:26539120, ECO:0000303|PubMed:26291527}..",,,,,,UniProt
uniprot-O00591,protein,Gamma-aminobutyric acid receptor subunit pi (GABA(A) receptor subunit pi) (GABAAR subunit pi),"Gene: GABRP. Organism: Homo sapiens (Human). Function: FUNCTION: Pi subunit of the heteropentameric ligand-gated chloride channel gated by gamma-aminobutyric acid (GABA) (PubMed:10462548). GABA-gated chloride channels, also named GABA(A) receptors (GABAAR), consist of five subunits arranged around a central pore and contain GABA active binding site(s) located at the alpha and beta subunit interfaces (By similarity). When activated by GABA, GABAARs selectively allow the flow of chloride anions across the cell membrane down their electrochemical gradient (PubMed:10462548). Pi-containing GABAARs are mostly located in peripheral tissues. In the uterus, pi subunits modulate uterus contraction by altering the sensitivity of GABAARs to pregnanolone (PubMed:9182563). In the lungs, pi-containing GABAARs contribute to pulmonary fluid transport via luminal secretion of chloride (By similarity). {ECO:0000250|UniProtKB:O09028, ECO:0000250|UniProtKB:P47870, ECO:0000269|PubMed:10462548, ECO:0000269|PubMed:9182563}..",,,,,,UniProt
uniprot-O00622,protein,CCN family member 1 (Cellular communication network factor 1) (Cysteine-rich angiogenic inducer 61) (Insulin-like growth factor-binding protein 10) (IBP-10) (IGF-binding protein 10) (IGFBP-10) (Protein CYR61) (Protein GIG1),"Gene: CCN1. Organism: Homo sapiens (Human). Function: FUNCTION: Promotes cell proliferation, chemotaxis, angiogenesis and cell adhesion. Appears to play a role in wound healing by up-regulating, in skin fibroblasts, the expression of a number of genes involved in angiogenesis, inflammation and matrix remodeling including VEGA-A, VEGA-C, MMP1, MMP3, TIMP1, uPA, PAI-1 and integrins alpha-3 and alpha-5. CCN1-mediated gene regulation is dependent on heparin-binding. Down-regulates the expression of alpha-1 and alpha-2 subunits of collagen type-1. Promotes cell adhesion and adhesive signaling through integrin alpha-6/beta-1, cell migration through integrin alpha-v/beta-5 and cell proliferation through integrin alpha-v/beta-3. {ECO:0000269|PubMed:11584015}..",,,,,,UniProt
uniprot-O00624,protein,Sodium-dependent phosphate transport protein 3 (Na(+)/PI cotransporter 3) (Sodium/phosphate cotransporter 3) (Solute carrier family 17 member 2),"Gene: SLC17A2. Organism: Homo sapiens (Human). Function: FUNCTION: Acts as a membrane potential-dependent organic anion transporter, the transport requires a low concentration of chloride ions (By similarity). Mediates chloride-dependent transport of urate (By similarity). Can actively transport inorganic phosphate into cells via Na(+) cotransport (By similarity). {ECO:0000250|UniProtKB:Q5SZA1}..",,,,,,UniProt
uniprot-O00635,protein,E3 ubiquitin-protein ligase TRIM38 (EC 2.3.2.27) (RING finger protein 15) (Tripartite motif-containing protein 38) (Zinc finger protein RoRet),"Gene: TRIM38. Organism: Homo sapiens (Human). Function: FUNCTION: E3 ubiquitin-protein and E3 SUMO-protein ligase that acts as a regulator of innate immunity (PubMed:23056470). Acts as a negative regulator of type I interferon IFN-beta production by catalyzing 'Lys-48'-linked polyubiquitination of AZI2/NAP1, leading to its degradation (By similarity). Mediates 'Lys-48'-linked polyubiquitination and proteasomal degradation of the critical TLR adapter TICAM1, inhibiting TLR3-mediated type I interferon signaling (PubMed:23056470). Acts as positive regulator of the cGAS-STING pathway by acting as a E3 SUMO-protein ligase: mediates sumoylation of CGAS and STING, preventing their degradation and thereby activating the innate immune response to DNA virus (By similarity). Also acts as a negative regulator of NF-kappa-B signaling independently of its E3 protein ligase activity by promoting lysosome-dependent degradation of TAB2 and TAB3 adapters (PubMed:24434549). {ECO:0000250|UniProtKB:Q5SZ99, ECO:0000269|PubMed:23056470, ECO:0000269|PubMed:24434549}..",,,,,,UniProt
uniprot-O00712,protein,Nuclear factor 1 B-type (NF1-B) (Nuclear factor 1/B) (CCAAT-box-binding transcription factor) (CTF) (Nuclear factor I/B) (NF-I/B) (NFI-B) (TGGCA-binding protein),"Gene: NFIB. Organism: Homo sapiens (Human). Function: FUNCTION: Transcriptional activator of GFAP, essential for proper brain development (PubMed:30388402). Recognizes and binds the palindromic sequence 5'-TTGGCNNNNNGCCAA-3' present in viral and cellular promoters and in the origin of replication of adenovirus type 2. These proteins are individually capable of activating transcription and replication. {ECO:0000269|PubMed:30388402}..",,,,,,UniProt
uniprot-O00746,protein,"Nucleoside diphosphate kinase D, mitochondrial (NDPK-D) (EC 2.7.4.6) (Nucleoside diphosphate kinase 4) (NDK4) (nm23-H4)","Gene: NME4. Organism: Homo sapiens (Human). Function: FUNCTION: Mitochondria-specific nucleoside diphosphate kinase that catalyzes the transfer of a gamma-phosphoryl group from ATP to a nucleoside diphosphate via a ping-pong mechanism involving a phosphohistidine intermediate, participating in nucleoside triphosphate homeostasis (PubMed:10799505, PubMed:16313181, PubMed:18635542, PubMed:23150663). In vitro, purine nucleoside triphosphates are much more effective as donors and acceptors than pyrimidine nucleoside triphosphates, and ribonucleosides derivatives are superior to their deoxyribonucleosides counterparts (By similarity). Associates with cardiolipin-containing mitochondrial inner membrane and locally produces ADP in the mitochondrial intermembrane space, which is directly taken up via the ADP/ATP translocase (ANT) into the matrix to stimulate respiratory ATP regeneration (PubMed:18635542, PubMed:24970086). Also directly provides GTP for mitochondrial GTPases, such as the dynamin-related GTPase OPA1 (PubMed:24970086). Additionally, catalyzes the anionic phospholipid transfer, namely cardiolipin, from the mitochondrial inner membrane (IM) to the outer membrane (OM) through the formation of contact sites between IM and OM, in a nucleoside diphosphate kinase-independent manner (PubMed:17028143, PubMed:23150663). The switch between the nucleoside diphosphate kinase and the phospholipid transfer activity may depend on the availability and accessibility of cardiolipin and other anionic phospholipids in the IM outer leaflet and OM inner leaflet (PubMed:23150663). {ECO:0000250|UniProtKB:P87355, ECO:0000269|PubMed:10799505, ECO:0000269|PubMed:16313181, ECO:0000269|PubMed:17028143, ECO:0000269|PubMed:18635542, ECO:0000269|PubMed:23150663, ECO:0000269|PubMed:24970086, ECO:0000305, ECO:0000305|PubMed:24970086}..",,,,,,UniProt
uniprot-O00748,protein,Cocaine esterase (EC 3.1.1.84) (Carboxylesterase 2) (CE-2) (hCE-2) (EC 3.1.1.1) (Methylumbelliferyl-acetate deacetylase 2) (EC 3.1.1.56),"Gene: CES2. Organism: Homo sapiens (Human). Function: FUNCTION: Involved in the detoxification of xenobiotics and in the activation of ester and amide prodrugs (PubMed:9169443). Shows high catalytic efficiency for hydrolysis of cocaine, 4-methylumbelliferyl acetate, heroin and 6-monoacetylmorphine (PubMed:9169443). Hydrolyzes aspirin, substrates with large alcohol group and small acyl group and endogenous lipids such as triacylglycerol (PubMed:28677105). Converts monoacylglycerides to free fatty acids and glycerol. Hydrolyzes of 2-arachidonoylglycerol and prostaglandins (PubMed:21049984). {ECO:0000269|PubMed:21049984, ECO:0000269|PubMed:9169443, ECO:0000303|PubMed:28677105}..",,,,,,UniProt
uniprot-O00762,protein,Ubiquitin-conjugating enzyme E2 C (EC 2.3.2.23) ((E3-independent) E2 ubiquitin-conjugating enzyme C) (EC 2.3.2.24) (E2 ubiquitin-conjugating enzyme C) (UbcH10) (Ubiquitin carrier protein C) (Ubiquitin-protein ligase C),"Gene: UBE2C. Organism: Homo sapiens (Human). Function: FUNCTION: Accepts ubiquitin from the E1 complex and catalyzes its covalent attachment to other proteins. In vitro catalyzes 'Lys-11'- and 'Lys-48'-linked polyubiquitination. Acts as an essential factor of the anaphase promoting complex/cyclosome (APC/C), a cell cycle-regulated ubiquitin ligase that controls progression through mitosis. Acts by initiating 'Lys-11'-linked polyubiquitin chains on APC/C substrates, leading to the degradation of APC/C substrates by the proteasome and promoting mitotic exit. {ECO:0000269|PubMed:15558010, ECO:0000269|PubMed:18485873, ECO:0000269|PubMed:19820702, ECO:0000269|PubMed:19822757, ECO:0000269|PubMed:20061386, ECO:0000269|PubMed:27259151, ECO:0000269|PubMed:27910872}..",,,,,,UniProt
uniprot-O14497,protein,"AT-rich interactive domain-containing protein 1A (ARID domain-containing protein 1A) (B120) (BRG1-associated factor 250) (BAF250) (BRG1-associated factor 250a) (BAF250A) (Osa homolog 1) (hOSA1) (SWI-like protein) (SWI/SNF complex protein p270) (SWI/SNF-related, matrix-associated, actin-dependent regulator of chromatin subfamily F member 1) (hELD)","Gene: ARID1A. Organism: Homo sapiens (Human). Function: FUNCTION: Involved in transcriptional activation and repression of select genes by chromatin remodeling (alteration of DNA-nucleosome topology). Component of SWI/SNF chromatin remodeling complexes that carry out key enzymatic activities, changing chromatin structure by altering DNA-histone contacts within a nucleosome in an ATP-dependent manner. Binds DNA non-specifically. Belongs to the neural progenitors-specific chromatin remodeling complex (npBAF complex) and the neuron-specific chromatin remodeling complex (nBAF complex). During neural development a switch from a stem/progenitor to a postmitotic chromatin remodeling mechanism occurs as neurons exit the cell cycle and become committed to their adult state. The transition from proliferating neural stem/progenitor cells to postmitotic neurons requires a switch in subunit composition of the npBAF and nBAF complexes. As neural progenitors exit mitosis and differentiate into neurons, npBAF complexes which contain ACTL6A/BAF53A and PHF10/BAF45A, are exchanged for homologous alternative ACTL6B/BAF53B and DPF1/BAF45B or DPF3/BAF45C subunits in neuron-specific complexes (nBAF). The npBAF complex is essential for the self-renewal/proliferative capacity of the multipotent neural stem cells. The nBAF complex along with CREST plays a role regulating the activity of genes essential for dendrite growth (By similarity). {ECO:0000250|UniProtKB:A2BH40, ECO:0000303|PubMed:12672490, ECO:0000303|PubMed:22952240, ECO:0000303|PubMed:26601204}..",,,,,,UniProt
uniprot-O14503,protein,Class E basic helix-loop-helix protein 40 (bHLHe40) (Class B basic helix-loop-helix protein 2) (bHLHb2) (Differentially expressed in chondrocytes protein 1) (DEC1) (Enhancer-of-split and hairy-related protein 2) (SHARP-2) (Stimulated by retinoic acid gene 13 protein),"Gene: BHLHE40. Organism: Homo sapiens (Human). Function: FUNCTION: Transcriptional repressor involved in the regulation of the circadian rhythm by negatively regulating the activity of the clock genes and clock-controlled genes (PubMed:12397359, PubMed:18411297). Acts as the negative limb of a novel autoregulatory feedback loop (DEC loop) which differs from the one formed by the PER and CRY transcriptional repressors (PER/CRY loop) (PubMed:14672706). Both these loops are interlocked as it represses the expression of PER1/2 and in turn is repressed by PER1/2 and CRY1/2 (PubMed:15193144). Represses the activity of the circadian transcriptional activator: CLOCK-BMAL1|BMAL2 heterodimer by competing for the binding to E-box elements (5'-CACGTG-3') found within the promoters of its target genes (PubMed:15560782). Negatively regulates its own expression and the expression of DBP and BHLHE41/DEC2 (PubMed:14672706). Acts as a corepressor of RXR and the RXR-LXR heterodimers and represses the ligand-induced RXRA and NR1H3/LXRA transactivation activity (PubMed:19786558). May be involved in the regulation of chondrocyte differentiation via the cAMP pathway (PubMed:19786558). Represses the transcription of NR0B2 and attentuates the transactivation of NR0B2 by the CLOCK-BMAL1 complex (PubMed:28797635). Drives the circadian rhythm of blood pressure through transcriptional repression of ATP1B1 in the cardiovascular system (PubMed:30012868). {ECO:0000269|PubMed:12397359, ECO:0000269|PubMed:14672706, ECO:0000269|PubMed:15193144, ECO:0000269|PubMed:15560782, ECO:0000269|PubMed:18411297, ECO:0000269|PubMed:19786558, ECO:0000269|PubMed:28797635, ECO:0000269|PubMed:30012868}..",,,,,,UniProt
uniprot-O14508,protein,Suppressor of cytokine signaling 2 (SOCS-2) (Cytokine-inducible SH2 protein 2) (CIS-2) (STAT-induced STAT inhibitor 2) (SSI-2),"Gene: SOCS2. Organism: Homo sapiens (Human). Function: FUNCTION: Substrate-recognition component of a cullin-5-RING E3 ubiquitin-protein ligase complex (ECS complex, also named CRL5 complex), which mediates the ubiquitination and subsequent proteasomal degradation of target proteins, such as EPOR and GHR (PubMed:11781573, PubMed:21980433, PubMed:25505247, PubMed:31182716, PubMed:34857742). Specifically recognizes and binds phosphorylated proteins via its SH2 domain, promoting their ubiquitination (PubMed:21980433, PubMed:25505247, PubMed:31182716, PubMed:34857742, PubMed:37816714). The ECS(SOCS2) complex acts as a key regulator of growth hormone receptor (GHR) levels by mediating ubiquitination and degradation of GHR, following GHR phosphorylation by JAK2 (PubMed:21980433, PubMed:25505247, PubMed:34857742). The ECS(SOCS2) also catalyzes ubiquitination and degradation of JAK2-phosphorylated EPOR (PubMed:11781573). {ECO:0000269|PubMed:11781573, ECO:0000269|PubMed:21980433, ECO:0000269|PubMed:25505247, ECO:0000269|PubMed:31182716, ECO:0000269|PubMed:34857742, ECO:0000269|PubMed:37816714}..",,,,,,UniProt
uniprot-O14519,protein,Cyclin-dependent kinase 2-associated protein 1 (CDK2-associated protein 1) (Deleted in oral cancer 1) (DOC-1) (Putative oral cancer suppressor),"Gene: CDK2AP1. Organism: Homo sapiens (Human). Function: FUNCTION: Inhibitor of cyclin-dependent kinase CDK2 (By similarity). Also acts as a component of the histone deacetylase NuRD complex which participates in the remodeling of chromatin (PubMed:16428440, PubMed:20523938, PubMed:28977666). {ECO:0000250|UniProtKB:O35207, ECO:0000269|PubMed:16428440, ECO:0000269|PubMed:20523938, ECO:0000269|PubMed:28977666}..",,,,,,UniProt
uniprot-O14524,protein,Nuclear envelope integral membrane protein 1,"Gene: NEMP1. Organism: Homo sapiens (Human). Function: FUNCTION: Together with EMD, contributes to nuclear envelope stiffness in germ cells (PubMed:32923640). Required for female fertility (By similarity). Essential for normal erythropoiesis (By similarity). Required for efficient nuclear envelope opening and enucleation during the late stages of erythroblast maturation (By similarity). {ECO:0000250|UniProtKB:Q6ZQE4, ECO:0000269|PubMed:32923640}..",,,,,,UniProt
uniprot-O14548,protein,"Cytochrome c oxidase subunit 7A2-like, mitochondrial (Cytochrome c oxidase subunit 7A-related protein) (COX7a-related protein) (Cytochrome c oxidase subunit VIIa-related protein) (EB1) (Supercomplex assembly factor 1)","Gene: COX7A2L. Organism: Homo sapiens (Human). Function: FUNCTION: Assembly factor that mediates the formation of some mitochondrial respiratory supercomplexes (respirasomes), thereby promoting oxidative phosphorylation and energy metabolism (PubMed:27545886, PubMed:30428348, PubMed:33727070, PubMed:36198313). Acts as a molecular adapter that associates with both mitochondrial respiratory complexes III (CIII) and IV (CIV), promoting their association (PubMed:27545886, PubMed:36198313). Mediates the formation of various mitochondrial respiratory supercomplexes, such as MCIII(2)IV(2), composed of two CIII and two CIV, and the CS-respirasome (MCI(1)III(2)IV(2)), composed of one CI, two CIII and two CIV (PubMed:27545886, PubMed:30428348). Not involved in the formation of the canonical respirasome (MCI(1)III(2)IV(1)), composed of one CI, two CIII and one CIV (By similarity). The formation of different respirasomes is important for cell adaptation to oxygen conditions and prevent metabolic exhaustion: supercomplexes mediated by COX7A2L/SCAF1 are required to maintain oxidative phosphorylation upon low oxygen conditions and promote metabolic rewiring toward glycolysis (PubMed:36198313). {ECO:0000250|UniProtKB:Q99KD6, ECO:0000269|PubMed:27545886, ECO:0000269|PubMed:30428348, ECO:0000269|PubMed:33727070, ECO:0000269|PubMed:36198313}..",,,,,,UniProt
uniprot-O14561,protein,"Acyl carrier protein, mitochondrial (ACP) (CI-SDAP) (NADH-ubiquinone oxidoreductase 9.6 kDa subunit)","Gene: NDUFAB1. Organism: Homo sapiens (Human). Function: FUNCTION: Carrier of the growing fatty acid chain in fatty acid biosynthesis (By similarity) (PubMed:27626371). Accessory and non-catalytic subunit of the mitochondrial membrane respiratory chain NADH dehydrogenase (Complex I), which functions in the transfer of electrons from NADH to the respiratory chain (PubMed:27626371). Accessory protein, of the core iron-sulfur cluster (ISC) assembly complex, that regulates, in association with LYRM4, the stability and the cysteine desulfurase activity of NFS1 and participates in the [2Fe-2S] clusters assembly on the scaffolding protein ISCU (PubMed:31664822). The core iron-sulfur cluster (ISC) assembly complex is involved in the de novo synthesis of a [2Fe-2S] cluster, the first step of the mitochondrial iron-sulfur protein biogenesis. This process is initiated by the cysteine desulfurase complex (NFS1:LYRM4:NDUFAB1) that produces persulfide which is delivered on the scaffold protein ISCU in a FXN-dependent manner. Then this complex is stabilized by FDX2 which provides reducing equivalents to accomplish the [2Fe-2S] cluster assembly. Finally, the [2Fe-2S] cluster is transferred from ISCU to chaperone proteins, including HSCB, HSPA9 and GLRX5 (By similarity). {ECO:0000250|UniProtKB:P52505, ECO:0000250|UniProtKB:Q9H1K1, ECO:0000269|PubMed:27626371, ECO:0000269|PubMed:31664822}..",,,,,,UniProt
uniprot-O14613,protein,Cdc42 effector protein 2 (Binder of Rho GTPases 1),"Gene: CDC42EP2. Organism: Homo sapiens (Human). Function: FUNCTION: Probably involved in the organization of the actin cytoskeleton. May act downstream of CDC42 to induce actin filament assembly leading to cell shape changes. Induces pseudopodia formation in fibroblasts in a CDC42-dependent manner. {ECO:0000269|PubMed:10490598, ECO:0000269|PubMed:11035016}..",,,,,,UniProt
uniprot-O14618,protein,Copper chaperone for superoxide dismutase (Superoxide dismutase copper chaperone),Gene: CCS. Organism: Homo sapiens (Human). Function: FUNCTION: Delivers copper to copper zinc superoxide dismutase (SOD1)..,,,,,,UniProt
uniprot-O14628,protein,Zinc finger protein 195,Gene: ZNF195. Organism: Homo sapiens (Human). Function: FUNCTION: May be involved in transcriptional regulation..,,,,,,UniProt
